{"sender":"57575701","body":"Your Link verification code is: 127015. To stop receiving these messages, please visit support.link.com\/sms-opt-out?id=kIywOxsNhIo%23GgUI6gEYAQ","timestamp":1768999839408,"date":"2026-01-21 18:20:39.408"}
{"sender":"AX-ICICIO-T","body":"967000 is One-Time Password for USD 0.00 transaction towards VERCEL INC  using ICICI Bank Credit Card XX0006. OTPs are SECRET. DO NOT disclose","timestamp":1768999089252,"date":"2026-01-21 18:08:09.252"}
{"sender":"JX-AHAVID-S","body":"<#> Your aha Verification Code for login is 2895. Enjoy Watching!! Team Arhamedia. emyVbWdK0yW","timestamp":1768998479945,"date":"2026-01-21 17:57:59.945"}
{"sender":"JM-AHAVID-S","body":"Congratulations! Your aha Gold is now active. You can now enjoy premium blockbuster movies, web series and a lot more. -aha","timestamp":1768998399740,"date":"2026-01-21 17:56:39.740"}
{"sender":"VM-ICICIT-S","body":"INR 999.00 spent using ICICI Bank Card XX0006 on 21-Jan-26 on GOOGLE PLAY. Avl Limit: INR 7,15,966.70. If not you, call 1800 2662\/SMS BLOCK 0006 to 9215676766.","timestamp":1768998390392,"date":"2026-01-21 17:56:30.392"}
{"sender":"AX-ICICIO-T","body":"943331 is One-Time Password for INR 999.00 transaction towards GOOGLEPLAY using ICICI Bank Credit Card XX0006. OTPs are SECRET. DO NOT disclose","timestamp":1768998350759,"date":"2026-01-21 17:55:50.759"}
{"sender":"VA-MYTNEU-S","body":"Hi! 800571 is your OTP to log in to Tata Neu. The code is valid for just 3 mins. It's great to have you back!\n-Team Tata Neu\n\nmytTjKEKMvy","timestamp":1768998131962,"date":"2026-01-21 17:52:11.962"}
{"sender":"AD-PTNNPS-S","body":"Investment value in Tier I (PRANXX9811) as on 31.12.25 is Rs 1,77,783.49.To know more about MSF click https:\/\/vil.ltd\/PTNNPS\/c\/QD26 -Protean","timestamp":1768987484820,"date":"2026-01-21 14:54:44.820"}
{"sender":"JA-JIOVOC-S","body":"Dear Customer, Click www.jio.com\/r\/CK2qA6ZaD to tell us how we can make your experience on Jio network even better. Thank you, Team Jio","timestamp":1768983192127,"date":"2026-01-21 13:43:12.127"}
{"sender":"JD-HDFCBK-S","body":"Credit Alert!\nRs.70.00 credited to HDFC Bank A\/c XX3562 on 21-01-26 from VPA 7337087749@yescred (UPI 638724566902)\n","timestamp":1768982047012,"date":"2026-01-21 13:24:07.012"}
{"sender":"JD-HDFCBK-S","body":"Sent Rs.140.00\nFrom HDFC Bank A\/C *2725\nTo M\/S.KARACHI INC\nOn 21\/01\/26\nRef 638707551063\nNot You?\nCall 18002586161\/SMS BLOCK UPI to 7308080808\n","timestamp":1768982026975,"date":"2026-01-21 13:23:46.975"}
{"sender":"VM-HDFCBN-S","body":"Dear Customer, We are pleased to inform you of an increased limit available on your HDFC Bank Credit Card. Check: https:\/\/hdfcbk.io\/HDFCBK\/s\/WZpw44kk","timestamp":1768972190815,"date":"2026-01-21 10:39:50.815"}
{"sender":"JM-HDFCBN-S","body":"Dear Customer,We are pleased to inform you of an increased limit available on your HDFC Bank Credit Card. Check:https:\/\/hdfcbk.io\/HDFCBK\/s\/gpL7Y6OB","timestamp":1768970125694,"date":"2026-01-21 10:05:25.694"}
{"sender":"JM-HDFCBK-S","body":"Available Bal in HDFC Bank A\/c XX2725 as on yesterday:20-JAN-26 is INR 97,929.47. Cheques are subject to clearing.For updated A\/C Bal dial 18002703333.","timestamp":1768960530595,"date":"2026-01-21 07:25:30.595"}
{"sender":"VD-HDFCBK-S","body":"HDFC Bank Cardmember, Online Payment of Rs.1846 vide Ref# 019153901jVQTpi was credited to your card ending 3838 On 19\/JAN\/2026_value Date 19\/JAN\/2026","timestamp":1768932417901,"date":"2026-01-20 23:36:57.901"}
{"sender":"JD-HDFCBK-S","body":"HDFC Bank Cardmember, Online Payment of Rs.4743 vide Ref# 019153813GNAtrZ was credited to your card ending 7725 On 19\/JAN\/2026_value Date 19\/JAN\/2026","timestamp":1768932307961,"date":"2026-01-20 23:35:07.961"}
{"sender":"AD-IDFCFB-S","body":"Your A\/C XXXXX286210 is credited with INR 1,00,000.00 on 20\/01\/26 08:10. Your new balance is INR 4,30,624.00. Team IDFC FIRST Bank","timestamp":1768876810672,"date":"2026-01-20 08:10:10.672"}
{"sender":"AD-HDFCBK-S","body":"Sent Rs.100000.00\nFrom HDFC Bank A\/C *2725\nTo Saikumar Reddy Godala\nOn 20\/01\/26\nRef 638618377038\nNot You?\nCall 18002586161\/SMS BLOCK UPI to 7308080808\n","timestamp":1768876809615,"date":"2026-01-20 08:10:09.615"}
{"sender":"JM-HDFCBK-S","body":"Available Bal in HDFC Bank A\/c XX2725 as on yesterday:19-JAN-26 is INR 1,97,929.47. Cheques are subject to clearing.For updated A\/C Bal dial 18002703333.","timestamp":1768876191492,"date":"2026-01-20 07:59:51.492"}
{"sender":"JK-NSETRA-S","body":"Dear CUZXXXXX0G,Your traded value for 19-JAN-26 CM Rs 49978.3 Check your registered email. For details contact broker -National Stock Exchange.","timestamp":1768838466530,"date":"2026-01-19 21:31:06.530"}
{"sender":"VM-ICICIT-S","body":"Payment of Rs 1.00 has been received on your ICICI Bank Credit Card XX2008 through Bharat Bill Payment System on 19-JAN-26.","timestamp":1768817832173,"date":"2026-01-19 15:47:12.173"}
{"sender":"AD-AXISBK-S","body":"Payment of INR 5200.06 has been received towards your Axis Bank Credit Card XX8887 on 19-01-26 - Axis Bank","timestamp":1768817525240,"date":"2026-01-19 15:42:05.240"}
{"sender":"VM-HDFCBK-T","body":"Sent Rs.5198.06\nFrom HDFC Bank A\/C *2725\nTo CRED Club\nOn 19\/01\/26\nRef 638507269217\nNot You?\nCall 18002586161\/SMS BLOCK UPI to 7308080808\n","timestamp":1768817380543,"date":"2026-01-19 15:39:40.543"}
{"sender":"AD-HDFCBK-S","body":"DEAR HDFCBANK CARDMEMBER, PAYMENT OF Rs. 1846.00 RECEIVED TOWARDS YOUR CREDIT CARD ENDING WITH 3838 ON 19-1-2026.YOUR AVAILABLE LIMIT IS RS. 448995.73","timestamp":1768817342526,"date":"2026-01-19 15:39:02.526"}
{"sender":"AD-HDFCBK-S","body":"Sent Rs.1846.00\nFrom HDFC Bank A\/C *2725\nTo CRED Club\nOn 19\/01\/26\nRef 638527281202\nNot You?\nCall 18002586161\/SMS BLOCK UPI to 7308080808\n","timestamp":1768817340748,"date":"2026-01-19 15:39:00.748"}
{"sender":"AD-HDFCBK-S","body":"DEAR HDFCBANK CARDMEMBER, PAYMENT OF Rs. 4743.00 RECEIVED TOWARDS YOUR CREDIT CARD ENDING WITH 7725 ON 19-1-2026.YOUR AVAILABLE LIMIT IS RS. 448536.81","timestamp":1768817298224,"date":"2026-01-19 15:38:18.224"}
{"sender":"VM-HDFCBK-T","body":"Sent Rs.4739.00\nFrom HDFC Bank A\/C *2725\nTo CRED Club\nOn 19\/01\/26\nRef 638520278875\nNot You?\nCall 18002586161\/SMS BLOCK UPI to 7308080808\n","timestamp":1768817296151,"date":"2026-01-19 15:38:16.151"}
{"sender":"JX-HDFCBK-S","body":"UPI Mandate:\nSent Rs.2000.00\nfrom HDFC Bank A\/c 2725\nTo Indian Clearing Corpor\n19\/01\/26\nRef 638553403018\nNot You? Call 18002586161\/SMS BLOCK UPI to 7308080808\n","timestamp":1768814858967,"date":"2026-01-19 14:57:38.967"}
{"sender":"CP-TNUCRD-S","body":"Important update Godala, We have credited 35 NeuCoins based on your latest NeuCard statement. Check your dashboard for referral benefits https:\/\/m.tneu.in\/TNUCRD\/k6v1L9x Tata Neu","timestamp":1768814062936,"date":"2026-01-19 14:44:22.936"}
{"sender":"JA-JIOINF-S","body":"Manage your account with ease. If you ever have a doubt, support is available instantly. Try the Call Back feature on the MyJio app today. Link: https:\/\/tiny.jio.com\/SSMJioCLBKC6","timestamp":1768813160293,"date":"2026-01-19 14:29:20.293"}
{"sender":"VM-HDFCBK-T","body":"Sent Rs.60000.00\nFrom HDFC Bank A\/C *2725\nTo ZERODHA BROKING LIMITED\nOn 19\/01\/26\nRef 102497733190\nNot You?\nCall 18002586161\/SMS BLOCK UPI to 7308080808\n","timestamp":1768807363768,"date":"2026-01-19 12:52:43.768"}
{"sender":"JM-PHONPE-S","body":"ZERODHA BROKING LIMITED has requested money from you on PhonePe.Rs.60000 will be debited from your account on approving the request - https:\/\/phone.pe\/PHONPE\/heexk6jf","timestamp":1768807355298,"date":"2026-01-19 12:52:35.298"}
{"sender":"JM-HDFCBK-S","body":"Available Bal in HDFC Bank A\/c XX2725 as on yesterday:18-JAN-26 is INR 2,71,712.53. Cheques are subject to clearing.For updated A\/C Bal dial 18002703333.","timestamp":1768787385413,"date":"2026-01-19 07:19:45.413"}
{"sender":"VD-ICICIT-S","body":"Dear Customer, your payment of INR 199.00 for NETFLIX to be debited from your ICICI Bank Credit Card 0006, as per Standing Instructions XI0YTidAvD, is due by 22\/01\/2026. To cancel this debit or your Standing Instructions, visit https:\/\/icici.co\/ICICIT\/ar\/16D7VJM >Cards>Credit Cards>Standing Instructions and Recurring Charges>Manage Standing Instructions.","timestamp":1768770953687,"date":"2026-01-19 02:45:53.687"}
{"sender":"CP-PHONPE-S","body":"You've paid Rs.5 via PhonePe gift card to NARESH MUDHIRAJ on Jan 18, 2026 at 7:05:59 PM. Not you? Call us on 022-68727374. Remaining balance Rs.0.","timestamp":1768743362327,"date":"2026-01-18 19:06:02.327"}
{"sender":"JM-PHONPE-S","body":"You've paid Rs.5 via PhonePe gift card to NARESH MUDHIRAJ on Jan 18, 2026 at 7:05:59 PM. Not you? Call us on 022-68727374. Remaining balance Rs.0.","timestamp":1768743361379,"date":"2026-01-18 19:06:01.379"}
{"sender":"JX-HDFCBK-S","body":"Txn Rs.15.00\nOn HDFC Bank Card 7725\nAt Q364101703@ybl\nby UPI 106758896907\nOn 18-01\nNot You?\nCall 18002586161\/SMS BLOCK CC 7725 to 7308080808\n","timestamp":1768743359254,"date":"2026-01-18 19:05:59.254"}
{"sender":"VM-HDFCBK-S","body":"E-Mandate!\nRs.2000.00 will be deducted on 19\/01\/26, 00:00:00\nFor Indian Clearing Corporation Ltd mandate\nUMN 27ee8fb2e8374b9ba49032f569bf7720@yespay\nMaintain Balance\n-HDFC Bank\n","timestamp":1768726479615,"date":"2026-01-18 14:24:39.615"}
{"sender":"VM-HDFCBK-T","body":"Sent Rs.1000.00\nFrom HDFC Bank A\/C *2725\nTo GODALA VIKAS REDDY\nOn 18\/01\/26\nRef 146195124873\nNot You?\nCall 18002586161\/SMS BLOCK UPI to 7308080808\n","timestamp":1768720337579,"date":"2026-01-18 12:42:17.579"}
{"sender":"JD-HDFCBK-S","body":"Available Bal in HDFC Bank A\/c XX2725 as on yesterday:17-JAN-26 is INR 2,72,712.53. Cheques are subject to clearing.For updated A\/C Bal dial 18002703333.","timestamp":1768702932344,"date":"2026-01-18 07:52:12.344"}
{"sender":"AD-AXISBK-S","body":"Spent INR 376\nAxis Bank Card no. XX8887\n17-01-26 20:56:55 IST\nPYU*Swiggy\nAvl Limit: INR 294423.94\nNot you? SMS BLOCK 8887 to 919951860002","timestamp":1768663621624,"date":"2026-01-17 20:57:01.624"}
{"sender":"JD-HDFCBK-S","body":"HDFC Bank Credit Card XX7725 Statement:\nTotal due: Rs.4,743.00\nMin.due: Rs.240.00\nPay by 05-02-2026\nView: https:\/\/1.hdfc.bank.in\/HDFCBK\/jf\/e09001d2","timestamp":1768650668412,"date":"2026-01-17 17:21:08.412"}
{"sender":"VM-ICICIT-S","body":"INR 2,146.30 spent using ICICI Bank Card XX0006 on 17-Jan-26 on AMAZON PAY IN E. Avl Limit: INR 7,16,965.64. If not you, call 1800 2662\/SMS BLOCK 0006 to 9215676766.","timestamp":1768649718825,"date":"2026-01-17 17:05:18.825"}
{"sender":"AD-HDFCBK-S","body":"Your HDFC Bank Credit Card XX3838 Statement is generated View: https:\/\/1.hdfc.bank.in\/HDFCBK\/a\/16CXsSq Pay: hdfcbk.io\/HDFCBK\/K\/DUvfEwWRFA1","timestamp":1768637298564,"date":"2026-01-17 13:38:18.564"}
{"sender":"JM-HDFCBK-S","body":"Amount Due\nRs.1846 on HDFC Bank Credit Card 3838. Pay instantly by 05\/FEB\/2026 via PayZapp > Bill Pay > Credit Card: https:\/\/hdfcbk.io\/HDFCBK\/s\/epaoPJaP","timestamp":1768636963189,"date":"2026-01-17 13:32:43.189"}
{"sender":"JM-HDFCBK-S","body":"Amount Due\nRs.4743 on HDFC Bank Credit Card 7725. Pay instantly by 05\/FEB\/2026 via PayZapp > Bill Pay > Credit Card: https:\/\/hdfcbk.io\/HDFCBK\/s\/Y7EVBepK","timestamp":1768635689228,"date":"2026-01-17 13:11:29.228"}
{"sender":"VM-HDFCBK-T","body":"Sent Rs.201.00\nFrom HDFC Bank A\/C *2725\nTo UTPAL DUTTA\nOn 17\/01\/26\nRef 638305922201\nNot You?\nCall 18002586161\/SMS BLOCK UPI to 7308080808\n","timestamp":1768629124548,"date":"2026-01-17 11:22:04.548"}
{"sender":"VM-HDFCBK-S","body":"Txn Rs.448.00\nOn HDFC Bank Card 7725\nAt zeptonow.esbz@hdfcbank\nby UPI 101605527153\nOn 17-01\nNot You?\nCall 18002586161\/SMS BLOCK CC 7725 to 7308080808\n","timestamp":1768625175724,"date":"2026-01-17 10:16:15.724"}
{"sender":"VM-HDFCBK-S","body":"Credit Alert!\nRs.20.00 credited to HDFC Bank A\/c XX2725 on 17-01-26 from VPA bhimcashback@hdfcbank (UPI 102482802316)\n","timestamp":1768625171451,"date":"2026-01-17 10:16:11.451"}
{"sender":"JM-HDFCBK-S","body":"Available Bal in HDFC Bank A\/c XX2725 as on yesterday:16-JAN-26 is INR 2,73,126.53. Cheques are subject to clearing.For updated A\/C Bal dial 18002703333.","timestamp":1768615226446,"date":"2026-01-17 07:30:26.446"}
{"sender":"VM-CDSLTX-S","body":"Dear investor, your Monthly CAS of PAN xxxxxx700G for the quarter ending DEC-25 is emailed on xxxxalasaikumar@gmail.com - CDSL","timestamp":1768575410558,"date":"2026-01-16 20:26:50.558"}
{"sender":"VM-MYCLIQ-P","body":"Hi,\nTried. Tested. Loved.\nShop bestsellers at EOSS & get EXTRA Rs. 500 OFF* with FLAT500\nDiscover: https:\/\/1kx.in\/MYCLIQ\/Xyv24Y2v5EE\nTeam Tata CLiQ Fashion","timestamp":1768572360842,"date":"2026-01-16 19:36:00.842"}
{"sender":"VM-HDFCBK-S","body":"Credit Alert!\nRs.50000.00 credited to HDFC Bank A\/c XX2725 on 16-01-26 from VPA vankayala.lalithaannapurna@ibl (UPI 715073726800)\n","timestamp":1768540585746,"date":"2026-01-16 10:46:25.746"}
{"sender":"JM-HDFCBK-S","body":"Available Bal in HDFC Bank A\/c XX2725 as on yesterday:15-JAN-26 is INR 2,23,126.53. Cheques are subject to clearing.For updated A\/C Bal dial 18002703333.","timestamp":1768527964750,"date":"2026-01-16 07:16:04.750"}
{"sender":"VM-ZOMATO-S","body":"Rs. 88.82 added to Zomato Money (on mobile ending with **7076). This balance expires on 13 Feb 2026.\nView balance: http:\/\/zoma.to\/ZOMATO\/ap\/xqzv\/zomatomoney -ZOMATO","timestamp":1768496121829,"date":"2026-01-15 22:25:21.829"}
{"sender":"AD-HDFCBK-S","body":"Spent Rs.888.19 On HDFC Bank Card 7725 At ZOMATO                Gur On 2026-01-15:21:48:37.Not You? To Block+Reissue Call 18002586161\/SMS BLOCK CC 7725 to 7308080808","timestamp":1768493927117,"date":"2026-01-15 21:48:47.117"}
{"sender":"CP-ZOMATO-S","body":"Payment of Rs. 33.92 from Zomato Money Balance is successful. Updated balance: Rs. 0.00. Contact zomatomoneysupport@zomato.com for queries. -ZOMATO","timestamp":1768493926130,"date":"2026-01-15 21:48:46.130"}
{"sender":"AD-HDFCBK-S","body":"Sent Rs.20.00\nFrom HDFC Bank A\/C *2725\nTo Bake Central\nOn 15\/01\/26\nRef 638117723219\nNot You?\nCall 18002586161\/SMS BLOCK UPI to 7308080808\n","timestamp":1768485260739,"date":"2026-01-15 19:24:20.739"}
{"sender":"JD-HDFCBK-S","body":"Update:\nWe got a request to link your HDFC Bank Credit Card 7725 to UPI. Not you? Call 18002586161 or SMS BLOCK CC 7725 to 7308080808.","timestamp":1768483839091,"date":"2026-01-15 19:00:39.091"}
{"sender":"AX-IDFCFB-S","body":"You have initiated the process of adding your IDFC FIRST Bank accounts to BHIM UPI. Not you? Contact IDFC FIRST Bank or register a complaint on 1800 10 888","timestamp":1768483828600,"date":"2026-01-15 19:00:28.600"}
{"sender":"AX-BHIMAP-S","body":"Your registration for BHIM app has started. If it is not you please report now to your bank. Do not share the card details\/OTP to avoid any financial loss NPCI","timestamp":1768483743773,"date":"2026-01-15 18:59:03.773"}
{"sender":"+918097187497","body":"DO NOT COPY, FORWARD or SHARE THIS MESSAGE under any circumstance. USE UPI PIN ONLY on UPI PIN page of the app <5980df67#f30d#42ee#946d#8d3a7960592>","timestamp":1768483742767,"date":"2026-01-15 18:59:02.767"}
{"sender":"JA-JIOINF-S","body":"Manage your account with ease. If you ever have a doubt, support is available instantly. Try the Call Back feature on the MyJio app today. Link: https:\/\/tiny.jio.com\/SSMJioCLBKC6","timestamp":1768466120181,"date":"2026-01-15 14:05:20.181"}
{"sender":"JD-HDFCBK-S","body":"Available Bal in HDFC Bank A\/c XX2725 as on yesterday:14-JAN-26 is INR 2,24,146.53. Cheques are subject to clearing.For updated A\/C Bal dial 18002703333.","timestamp":1768442816676,"date":"2026-01-15 07:36:56.676"}
{"sender":"CP-ZOMATO-S","body":"Rs. 33.92 added to Zomato Money (on mobile ending with **7076). This balance expires on 12 Feb 2026.\nView balance: http:\/\/zoma.to\/ZOMATO\/ap\/xqzv\/zomatomoney -ZOMATO","timestamp":1768402024828,"date":"2026-01-14 20:17:04.828"}
{"sender":"AD-HDFCBK-S","body":"Spent Rs.339.2 On HDFC Bank Card 7725 At ZOMATO                Gur On 2026-01-14:19:42:02.Not You? To Block+Reissue Call 18002586161\/SMS BLOCK CC 7725 to 7308080808","timestamp":1768399930757,"date":"2026-01-14 19:42:10.757"}
{"sender":"VM-HDFCBK-S","body":"Sent Rs.1207.29\nFrom HDFC Bank A\/C *2725\nTo SHIVKUMAR\nOn 14\/01\/26\nRef 146071442388\nNot You?\nCall 18002586161\/SMS BLOCK UPI to 7308080808\n","timestamp":1768364277857,"date":"2026-01-14 09:47:57.857"}
{"sender":"AD-HDFCBK-S","body":"UPI Mandate:\nSent Rs.699.00\nfrom HDFC Bank A\/c 2725\nTo EENADUTELEVISIONPRIVAT\n14\/01\/26\nRef 102461807246\nNot You? Call 18002586161\/SMS BLOCK UPI to 7308080808\n","timestamp":1768363204803,"date":"2026-01-14 09:30:04.803"}
{"sender":"JX-HDFCBK-S","body":"Mandate Set\nRs.699.00\nFor EENADUTELEVISIONPRIVATELI\nFrom HDFC Bank A\/c x2725\nUMN: 9419e218103543b8981d34afc8ecf0c1@yb\nNot you?\nCall 18002586161\n","timestamp":1768363201840,"date":"2026-01-14 09:30:01.840"}
{"sender":"AD-ETVWIN-S","body":"Your Mobile Verification OTP for ETV Win is: #213277","timestamp":1768363155715,"date":"2026-01-14 09:29:15.715"}
{"sender":"CP-AXISBK-S","body":"Your statement for Axis Bank Credit Card no. XX8887 is generated.\nDue on: 01-02-26\nTotal amt: INR  Dr. 5200.06\nMin amt due: INR  Dr. 104.00\nPay at axis.bank.in\/ccpaynow\nTo view fees & charges: axis.bank.in\/kfs\nTo view\/download statement: https:\/\/ccm.axis.bank.in\/AXISBK\/AGtoXUbT","timestamp":1768362910542,"date":"2026-01-14 09:25:10.542"}
{"sender":"JA-JIOINF-S","body":"Manage your account with ease. If you ever have a doubt, support is available instantly. Try the Call Back feature on the MyJio app today. Link: https:\/\/tiny.jio.com\/SSMJioCLBKC6","timestamp":1768293089257,"date":"2026-01-13 14:01:29.257"}
{"sender":"AD-SSFBLT-S","body":"Stay Alert of online relationship scams! Fraudsters create fake bonds to exploit trust. Never share sensitive information or transfer money. - Shivalik Bank","timestamp":1768288734351,"date":"2026-01-13 12:48:54.351"}
{"sender":"JD-HDFCBK-S","body":"Available Bal in HDFC Bank A\/c XX2725 as on yesterday:12-JAN-26 is INR 2,26,052.82. Cheques are subject to clearing.For updated A\/C Bal dial 18002703333.","timestamp":1768269912884,"date":"2026-01-13 07:35:12.884"}
{"sender":"JM-ICICIT-S","body":"INR 79.00 spent using ICICI Bank Card XX0006 on 12-Jan-26 on AMAZON INDIA CY. Avl Limit: INR 7,19,111.94. If not you, call 1800 2662\/SMS BLOCK 0006 to 9215676766.","timestamp":1768227371196,"date":"2026-01-12 19:46:11.196"}
{"sender":"AX-ICICIT-S","body":"Dear Customer, we have successfully processed the payment of INR 79.00 for Amazon, as per the Standing Instruction Xz6JCD7Lv9, on 12\/01\/2026 for your ICICI Bank Credit Card 0006. To manage your Standing Instructions, visit https:\/\/icici.co\/ICICIT\/ar\/16BoQNQ >Cards >Credit Cards>Standing Instructions and Recurring Charges>Manage Standing Instructions.","timestamp":1768227353721,"date":"2026-01-12 19:45:53.721"}
{"sender":"JA-JIOINF-S","body":"We value your experience. If you need help, let us come to you. Request a Call Back via the MyJio app instantly. Support is just a tap away. Click: https:\/\/tiny.jio.com\/SSMJioCLBKC6","timestamp":1768210310484,"date":"2026-01-12 15:01:50.484"}
{"sender":"VM-HDFCBK-S","body":"UPI Mandate:\nSent Rs.2000.00\nfrom HDFC Bank A\/c 2725\nTo Indian Clearing Corpor\n12\/01\/26\nRef 637893303941\nNot You? Call 18002586161\/SMS BLOCK UPI to 7308080808\n","timestamp":1768209504676,"date":"2026-01-12 14:48:24.676"}
{"sender":"VM-HDFCBK-T","body":"Sent Rs.82.00\nFrom HDFC Bank A\/C *2725\nTo A MANOHARACHARI\nOn 12\/01\/26\nRef 637821213887\nNot You?\nCall 18002586161\/SMS BLOCK UPI to 7308080808\n","timestamp":1768204776846,"date":"2026-01-12 13:29:36.846"}
{"sender":"AX-HDFCBK-S","body":"Credit Alert!\nRs.3000.00 credited to HDFC Bank A\/c XX2725 on 12-01-26 from VPA 8555892971@ibl (UPI 350276459227)\n","timestamp":1768194463222,"date":"2026-01-12 10:37:43.222"}
{"sender":"AX-HDFCBK-S","body":"Credit Alert!\nRs.97000.00 credited to HDFC Bank A\/c XX2725 on 12-01-26 from VPA 9949530533-2@axl (UPI 528730653454)\n","timestamp":1768194450618,"date":"2026-01-12 10:37:30.618"}
{"sender":"JD-HDFCBK-S","body":"Credit Alert!\nRs.1.00 credited to HDFC Bank A\/c XX2725 on 12-01-26 from VPA 9949530533-2@ybl (UPI 925862894189)\n","timestamp":1768194203590,"date":"2026-01-12 10:33:23.590"}
{"sender":"JM-HDFCBK-S","body":"Received!\nINR 1.00 in HDFC Bank A\/c xx2725\nOn 12-01-26\nFor IMPS -AFPL- 601293806241\nAvl bal INR 1,28,133.82","timestamp":1768193757092,"date":"2026-01-12 10:25:57.092"}
{"sender":"JD-SBICRD-S","body":"Dear Cardholder, there is a credit balance of Rs. 79.02 available on your SBI Card account as on 11-Jan-2026. You can utilize this amount against any transaction(s) made with your credit card. Please ignore if already utilized.","timestamp":1768132994439,"date":"2026-01-11 17:33:14.439"}
{"sender":"AX-HDFCBK-S","body":"E-Mandate!\nRs.2000.00 will be deducted on 12\/01\/26, 00:00:00\nFor Indian Clearing Corporation Ltd mandate\nUMN 27ee8fb2e8374b9ba49032f569bf7720@yespay\nMaintain Balance\n-HDFC Bank\n","timestamp":1768121104602,"date":"2026-01-11 14:15:04.602"}
{"sender":"CP-NBPNM-P","body":"Hi, 20+ moves completed in hyderabad in the last 24 hrs! Your turn to move stress-free with NoBroker Packers & Movers. Book now: http:\/\/a.nobrkr.com\/NBPNM\/qEDPoky","timestamp":1768116205974,"date":"2026-01-11 12:53:25.974"}
{"sender":"JM-HDFCBK-S","body":"Available Bal in HDFC Bank A\/c XX2725 as on yesterday:10-JAN-26 is INR 1,28,132.82. Cheques are subject to clearing.For updated A\/C Bal dial 18002703333.","timestamp":1768096664835,"date":"2026-01-11 07:27:44.835"}
{"sender":"AX-HDFCBK-S","body":"Sent Rs.50000.00\nFrom HDFC Bank A\/C *2725\nTo VANKAYALA NAGA SRIVENKATA\nOn 10\/01\/26\nRef 813186314884\nNot You?\nCall 18002586161\/SMS BLOCK UPI to 7308080808\n","timestamp":1768060857870,"date":"2026-01-10 21:30:57.870"}
{"sender":"JX-PLAYO-P","body":"Psst! Near you, there are 700+ venues, 100+ Trainers\/Academies and 9500+ sports activities planned regularly! Come back? tlux.in\/PLAYO\/mbvaA -PLAYO","timestamp":1768026444644,"date":"2026-01-10 11:57:24.644"}
{"sender":"AD-AXISBK-S","body":"Spent INR 140\nAxis Bank Card no. XX8887\n10-01-26 09:29:41 IST\nPYU*Swiggy\nAvl Limit: INR 294799.94\nNot you? SMS BLOCK 8887 to 919951860002","timestamp":1768017586516,"date":"2026-01-10 09:29:46.516"}
{"sender":"AD-HDFCBK-S","body":"Txn Rs.592.00\nOn HDFC Bank Card 7725\nAt myntra2.payu@hdfcbank\nby UPI 108951655519\nOn 10-01\nNot You?\nCall 18002586161\/SMS BLOCK CC 7725 to 7308080808\n","timestamp":1768013467511,"date":"2026-01-10 08:21:07.511"}
{"sender":"JM-HDFCBK-S","body":"Available Bal in HDFC Bank A\/c XX2725 as on yesterday:09-JAN-26 is INR 1,78,132.82. Cheques are subject to clearing.For updated A\/C Bal dial 18002703333.","timestamp":1768011638514,"date":"2026-01-10 07:50:38.514"}
{"sender":"JX-EPFOHO-S","body":"EPFO YouTube is now @officialepfo. Please join to youtube.com\/@officialepfo to watch informative videos on latest updates on EPF, Pension and EDLI. Team EPFO","timestamp":1768001224730,"date":"2026-01-10 04:57:04.730"}
{"sender":"AD-ICICIT-S","body":"ICICI Bank Acct XX294 debited for Rs 1.00 on 09-Jan-26; aishwarya rao00 credited. UPI:637552882537. Call 18002662 for dispute. SMS BLOCK 294 to 9215676766.","timestamp":1767979555083,"date":"2026-01-09 22:55:55.083"}
{"sender":"VM-HDFCBK-S","body":"UPI Activated!\nYou've linked your Bank A\/c to UPI on Google Pay.\nNEVER share OTP, PIN, card info.\n- HDFC Bank","timestamp":1767979544071,"date":"2026-01-09 22:55:44.071"}
{"sender":"VM-HDFCBK-S","body":"UPI Registration Initiated!\nBy Google Pay for your Bank A\/c.\nYou will receive your UPI address shortly.\n-HDFC Bank","timestamp":1767979539521,"date":"2026-01-09 22:55:39.521"}
{"sender":"VA-ICICIT-S","body":"Google Pay registration is initiated for ICICI Bank. If not done by you, report to your bank. Card details\/OTP\/CVV are SECRET. DO NOT disclose it to anyone.","timestamp":1767979536301,"date":"2026-01-09 22:55:36.301"}
{"sender":"CP-AXISBK-S","body":"UPI registration on Google Pay has started. Do not share Debit Card details\/OTP\/expiry date to avoid financial loss. Not you? Report to your bank - Axis Bank","timestamp":1767979527624,"date":"2026-01-09 22:55:27.624"}
{"sender":"+919319888366","body":"HDFCUPI JAEKl6tcClKOnJXAqKBl3GNNGEBlb1K3ibmNIMNuz7GwrMsE%2BENqCDGmckB2fJD0","timestamp":1767979522501,"date":"2026-01-09 22:55:22.501"}
{"sender":"+917291066009","body":"JP7 h6#$C1C!#*%!Az*$!%E!LGb6D!d4*7J#JPx%*FP*!y78X","timestamp":1767979522233,"date":"2026-01-09 22:55:22.233"}
{"sender":"+918433977236","body":"SBIUPI tcFJ4RPArgfDfArlLmGo8BanVcFT%2BXYadsctvypNocf62g%2BO2N0zYA5KhkmyHD2q!cc7f178b7624708e0f151638e85542870fad8e46792fea0e8af794ea4c28e6c8","timestamp":1767979521185,"date":"2026-01-09 22:55:21.185"}
{"sender":"+918448189604","body":"JP7 W2*C472*8fx147Tp*p1x73n1**f*22nkU8Y","timestamp":1767979520804,"date":"2026-01-09 22:55:20.804"}
{"sender":"JM-HDFCBK-S","body":"Sent Rs.20.00\nFrom HDFC Bank A\/C *2725\nTo GADDAM CHANDI PRIYA\nOn 09\/01\/26\nRef 637501789525\nNot You?\nCall 18002586161\/SMS BLOCK UPI to 7308080808\n","timestamp":1767969433576,"date":"2026-01-09 20:07:13.576"}
{"sender":"AD-ICICIT-S","body":"Dear Customer, your payment of INR 79.00 for Amazon to be debited from your ICICI Bank Credit Card 0006, as per Standing Instructions Xz6JCD7Lv9, is due by 12\/01\/2026. To cancel this debit or your Standing Instructions, visit https:\/\/icici.co\/ICICIT\/ar\/16AOY9F >Cards>Credit Cards>Standing Instructions and Recurring Charges>Manage Standing Instructions.","timestamp":1767968714680,"date":"2026-01-09 19:55:14.680"}
{"sender":"AD-HDFCBK-S","body":"Sent Rs.32.00\nFrom HDFC Bank A\/C *2725\nTo A MANOHARACHARI\nOn 09\/01\/26\nRef 637525718037\nNot You?\nCall 18002586161\/SMS BLOCK UPI to 7308080808\n","timestamp":1767942925089,"date":"2026-01-09 12:45:25.089"}
{"sender":"VM-HDFCBK-S","body":"Txn Rs.100.00\nOn HDFC Bank Card 7725\nAt paytmqr6mqyk9@ptys\nby UPI 108946134777\nOn 09-01\nNot You?\nCall 18002586161\/SMS BLOCK CC 7725 to 7308080808\n","timestamp":1767942694475,"date":"2026-01-09 12:41:34.475"}
{"sender":"JM-HDFCBK-S","body":"Available Bal in HDFC Bank A\/c XX2725 as on yesterday:08-JAN-26 is INR 1,78,184.82. Cheques are subject to clearing.For updated A\/C Bal dial 18002703333.","timestamp":1767926351023,"date":"2026-01-09 08:09:11.023"}
{"sender":"JM-NSESMS-S","body":"ZERODHA BROKING LIMITED on 03-01-26 reported your Fund bal Rs.0 & Securities bal 0. This excludes your Bank, DP & PMS bal with the broker-NSE","timestamp":1767895328086,"date":"2026-01-08 23:32:08.086"}
{"sender":"JX-HDFCBK-S","body":"Txn Rs.870.00\nOn HDFC Bank Card 7725\nAt mandikingarabianrest.6603\nby UPI 712096296716\nOn 08-01\nNot You?\nCall 18002586161\/SMS BLOCK CC 7725 to 7308080808\n","timestamp":1767884106989,"date":"2026-01-08 20:25:06.989"}
{"sender":"CP-ICICIT-S","body":"Important update regarding changes to the features and charges of your ICICI Bank Credit Card XX4001. Visit icici.co\/ICICIT\/k\/DUvOdDSPDM1   for details.","timestamp":1767875891757,"date":"2026-01-08 18:08:11.757"}
{"sender":"CP-ICICIT-S","body":"Important update regarding changes to the features and charges of your ICICI Bank Credit Card XX0006. Visit icici.co\/ICICIT\/k\/DUvOdDSPDM1   for details.","timestamp":1767875813693,"date":"2026-01-08 18:06:53.693"}
{"sender":"CP-ICICIT-S","body":"Important update regarding changes to the features and charges of your ICICI Bank Credit Card XX2008. Visit icici.co\/ICICIT\/k\/DUvOdDSPDM1   for details.","timestamp":1767875790768,"date":"2026-01-08 18:06:30.768"}
{"sender":"AD-AXISBK-S","body":"Congratulations! Cashback of INR 517 has been credited to your Airtel Axis Bank Credit Card XX8887 towards your spends during DEC'25.","timestamp":1767855497583,"date":"2026-01-08 12:28:17.583"}
{"sender":"+918887717993","body":"After work rest, I noticed a reading corner where 46800 appeared casually. https:\/\/tew.snapre.us\/g0VJ0","timestamp":1767754001308,"date":"2026-01-07 08:16:41.308"}
{"sender":"+917381549038","body":"Some people keep it short, I noticed 41300 once. https:\/\/snapre.us\/Tof4a","timestamp":1767753809458,"date":"2026-01-07 08:13:29.458"}
{"sender":"+918099701109","body":"Some people keep it short, I noticed 41300 once. https:\/\/snapre.us\/Tof4a","timestamp":1767753463430,"date":"2026-01-07 08:07:43.430"}
{"sender":"+918960798590","body":"After work rest, I noticed a reading corner where 46800 appeared casually. https:\/\/tew.snapre.us\/g0VJ0","timestamp":1767753442158,"date":"2026-01-07 08:07:22.158"}
{"sender":"JM-HDFCBK-S","body":"Available Bal in HDFC Bank A\/c XX2725 as on yesterday:05-JAN-26 is INR 1,78,237.92. Cheques are subject to clearing.For updated A\/C Bal dial 18002703333.","timestamp":1767663497929,"date":"2026-01-06 07:08:17.929"}
{"sender":"AD-HDFCBK-S","body":"Sent Rs.100.00\nFrom HDFC Bank A\/C *2725\nTo GODALA VIKAS REDDY\nOn 05\/01\/26\nRef 797831466879\nNot You?\nCall 18002586161\/SMS BLOCK UPI to 7308080808\n","timestamp":1767616182309,"date":"2026-01-05 17:59:42.309"}
{"sender":"AD-ICICIT-S","body":"INR 299.00 spent using ICICI Bank Card XX0006 on 05-Jan-26 on YOUTUBEGOOGLE. Avl Limit: INR 7,19,190.94. If not you, call 1800 2662\/SMS BLOCK 0006 to 9215676766.","timestamp":1767606246056,"date":"2026-01-05 15:14:06.056"}
{"sender":"JD-ICICIT-S","body":"Dear Customer, we have successfully processed the payment of INR 299.00 for Youtube, as per the Standing Instruction XQFFH8LDfH, on 05\/01\/2026 for your ICICI Bank Credit Card 0006. To manage your Standing Instructions, visit www.icicibank.com >Cards >Credit Cards>Standing Instructions and Recurring Charges>Manage Standing Instructions.","timestamp":1767606235404,"date":"2026-01-05 15:13:55.404"}
{"sender":"VM-HDFCBK-S","body":"Sent Rs.50000.00\nFrom HDFC Bank A\/C *2725\nTo PARIMI VENKATA SIVARAMA PAVAN KUMAR\nOn 05\/01\/26\nRef 637117069807\nNot You?\nCall 18002586161\/SMS BLOCK UPI to 7308080808\n","timestamp":1767597378395,"date":"2026-01-05 12:46:18.395"}
{"sender":"JM-HDFCBK-S","body":"UPI Mandate:\nSent Rs.2000.00\nfrom HDFC Bank A\/c 2725\nTo Indian Clearing Corpor\n05\/01\/26\nRef 600517024678\nNot You? Call 18002586161\/SMS BLOCK UPI to 7308080808\n","timestamp":1767586469931,"date":"2026-01-05 09:44:29.931"}
{"sender":"JD-ICICIT-S","body":"ICICI Bank Credit Card XX0006 Statement is sent to go**********ar@gmail.com. Total of Rs 6,709.00 or minimum of Rs 340.00 is due by 15-JAN-26.","timestamp":1767525268204,"date":"2026-01-04 16:44:28.204"}
{"sender":"AD-IDFCFB-T","body":"Your A\/c XX6210 debited by Rs. 1,00,000.00 on 04\/01\/26; VAJRAPU SUVARNA PRAK credited. RRN 637018925951. Available balance Rs. 3,30,624.00. Team IDFC FIRST Bank","timestamp":1767519753669,"date":"2026-01-04 15:12:33.669"}
{"sender":"AD-AXISBK-S","body":"Spent INR 329\nAxis Bank Card no. XX8887\n04-01-26 11:14:29 IST\nPYU*Instama\nAvl Limit: INR 294422.94\nNot you? SMS BLOCK 8887 to 919951860002","timestamp":1767505473758,"date":"2026-01-04 11:14:33.758"}
{"sender":"AD-AIRBNK-S","body":"Southern Power Distribution Company of Telangana Limited payment for 103045359 with Rs.867.0 on 04-01-2026 is successful, Txn ID -560104091995725. Not You?Call 180023400 - Airtel Payments Bank","timestamp":1767499578733,"date":"2026-01-04 09:36:18.733"}
{"sender":"CP-AXISBK-S","body":"Spent INR 886.42\nAxis Bank Card no. XX8887\n04-01-26 09:34:51 IST\nAIRTEL PAYM\nAvl Limit: INR 294751.94\nNot you? SMS BLOCK 8887 to 919951860002","timestamp":1767499495540,"date":"2026-01-04 09:34:55.540"}
{"sender":"AA-AIRINF","body":"Hi, Payment of Rs. 886.42 done via Credit Card for Electricity has been processed. Order ID: 7413430075890139136. You will receive the payment posting confirmation within maximum 48 hrs. Click i.airtel.in\/Utilities_Tsn-history  to know the transaction status or call 180023400 from your mobile number in case of any query.","timestamp":1767499494089,"date":"2026-01-04 09:34:54.089"}
{"sender":"JD-HDFCBK-S","body":"E-Mandate!\nRs.2000.00 will be deducted on 05\/01\/26, 00:00:00\nFor Indian Clearing Corporation Ltd mandate\nUMN 27ee8fb2e8374b9ba49032f569bf7720@yespay\nMaintain Balance\n-HDFC Bank\n","timestamp":1767498118370,"date":"2026-01-04 09:11:58.370"}
{"sender":"JM-HDFCBK-S","body":"Available Bal in HDFC Bank A\/c XX2725 as on yesterday:03-JAN-26 is INR 2,30,337.92. Cheques are subject to clearing.For updated A\/C Bal dial 18002703333.","timestamp":1767492630336,"date":"2026-01-04 07:40:30.336"}
{"sender":"AD-AXISBK-S","body":"Due to scheduled maintenance, txns. with Axis Bank Credit Card on 08-01-26, 01:45 AM - 02:30 AM IST will be paused. Inconvenience caused is regretted.","timestamp":1767491331323,"date":"2026-01-04 07:18:51.323"}
{"sender":"VM-IDFCFB-S","body":"Your A\/C XXXXX286210 is credited with INR 50,000.00 on 03\/01\/26 21:13. Your new balance is INR 4,30,624.00. Team IDFC FIRST Bank","timestamp":1767455716496,"date":"2026-01-03 21:25:16.496"}
{"sender":"JD-HDFCBK-S","body":"Sent Rs.50000.00\nFrom HDFC Bank A\/C *2725\nTo Saikumar Reddy Godala\nOn 03\/01\/26\nRef 636926800548\nNot You?\nCall 18002586161\/SMS BLOCK UPI to 7308080808\n","timestamp":1767455006349,"date":"2026-01-03 21:13:26.349"}
{"sender":"JD-HDFCBK-S","body":"Sent Rs.20000.00\nFrom HDFC Bank A\/C *2725\nTo PARIGI DURGAPRASAD\nOn 03\/01\/26\nRef 968342254340\nNot You?\nCall 18002586161\/SMS BLOCK UPI to 7308080808\n","timestamp":1767453466569,"date":"2026-01-03 20:47:46.569"}
{"sender":"AD-HDFCBK-S","body":"Sent Rs.20000.00\nFrom HDFC Bank A\/C *2725\nTo RANGINENI MOUNIKA\nOn 03\/01\/26\nRef 343936797870\nNot You?\nCall 18002586161\/SMS BLOCK UPI to 7308080808\n","timestamp":1767453446969,"date":"2026-01-03 20:47:26.969"}
{"sender":"JX-ICICIT-S","body":"Dear Customer, your payment of INR 299.00 for Youtube to be debited from your ICICI Bank Credit Card 0006, as per Standing Instructions XQFFH8LDfH, is due by 05\/01\/2026. To cancel this debit or your Standing Instructions, visit www.icicibank.com >Cards>Credit Cards>Standing Instructions and Recurring Charges>Manage Standing Instructions.","timestamp":1767433432113,"date":"2026-01-03 15:13:52.113"}
{"sender":"AD-HDFCBK-S","body":"Txn Rs.32.00\nOn HDFC Bank Card 7725\nAt paytmqr70ujfn@ptys \nby UPI 636919714260\nOn 03-01\nNot You?\nCall 18002586161\/SMS BLOCK CC 7725 to 7308080808\n","timestamp":1767431843580,"date":"2026-01-03 14:47:23.580"}
{"sender":"VM-HDFCBK-S","body":"Txn Rs.40.00\nOn HDFC Bank Card 7725\nAt paytmqr70ujfn@ptys \nby UPI 636916723411\nOn 03-01\nNot You?\nCall 18002586161\/SMS BLOCK CC 7725 to 7308080808\n","timestamp":1767431818002,"date":"2026-01-03 14:46:58.002"}
{"sender":"AD-HDFCBK-S","body":"Txn Rs.1000.00\nOn HDFC Bank Card 7725\nAt q354553035@ybl \nby UPI 636900702395\nOn 03-01\nNot You?\nCall 18002586161\/SMS BLOCK CC 7725 to 7308080808\n","timestamp":1767427301572,"date":"2026-01-03 13:31:41.572"}
{"sender":"VM-HDFCBK-S","body":"Txn Rs.30.00\nOn HDFC Bank Card 7725\nAt q918863195@ybl \nby UPI 636915686196\nOn 03-01\nNot You?\nCall 18002586161\/SMS BLOCK CC 7725 to 7308080808\n","timestamp":1767421105680,"date":"2026-01-03 11:48:25.680"}
{"sender":"AX-AXISBK-S","body":"Spent INR 200\nAxis Bank Card no. XX8887\n02-01-26 23:35:17 IST\nPYU*Instama\nAvl Limit: INR 295638.36\nNot you? SMS BLOCK 8887 to 919951860002","timestamp":1767377122444,"date":"2026-01-02 23:35:22.444"}
{"sender":"AD-ICICIT-S","body":"INR 510.00 spent using ICICI Bank Card XX0006 on 02-Jan-26 on AMAZON PAY IN E. Avl Limit: INR 7,19,489.94. If not you, call 1800 2662\/SMS BLOCK 0006 to 9215676766.","timestamp":1767323980825,"date":"2026-01-02 08:49:40.825"}
{"sender":"JM-HDFCBK-S","body":"Available Bal in HDFC Bank A\/c XX2725 as on yesterday:01-JAN-26 is INR 3,19,442.53. Cheques are subject to clearing.For updated A\/C Bal dial 18002703333.","timestamp":1767320671293,"date":"2026-01-02 07:54:31.293"}
{"sender":"AX-AXISBK-S","body":"Spent INR 663\nAxis Bank Card no. XX8887\n01-01-26 20:15:14 IST\nPYU*Swiggy\nAvl Limit: INR 295838.36\nNot you? SMS BLOCK 8887 to 919951860002","timestamp":1767278719316,"date":"2026-01-01 20:15:19.316"}
{"sender":"VM-HDFCBK-S","body":"Sent Rs.509.25\nFrom HDFC Bank A\/C *2725\nTo Redbus India Private Limited\nOn 01\/01\/26\nRef 600120441442\nNot You?\nCall 18002586161\/SMS BLOCK UPI to 7308080808\n","timestamp":1767278202146,"date":"2026-01-01 20:06:42.146"}
{"sender":"AD-PHONPE-S","body":"Redbus India Private Limited has requested money from you on PhonePe.Rs.509.25 will be debited from your account on approving the request - https:\/\/phone.pe\/PHONPE\/qjom6zey","timestamp":1767278190052,"date":"2026-01-01 20:06:30.052"}
{"sender":"AX-SWIGGY-S","body":"Refund of Rs 663.0 has been initiated for Swiggy order 226245924206777. Updated balance should reflect in 4-7 days. https:\/\/r.swiggy.com\/refunds","timestamp":1767277238364,"date":"2026-01-01 19:50:38.364"}
{"sender":"AD-SWIGGY-S","body":"Your payment for Swiggy order #226245924206777 was not completed. Any amount if debited from PhonePe will get refunded within 4-7 days.","timestamp":1767276926203,"date":"2026-01-01 19:45:26.203"}
{"sender":"VM-HDFCBK-S","body":"Txn Rs.663.00\nOn HDFC Bank Card 7725\nAt SWIGGY8@ybl \nby UPI 341728971571\nOn 01-01\nNot You?\nCall 18002586161\/SMS BLOCK CC 7725 to 7308080808\n","timestamp":1767276334962,"date":"2026-01-01 19:35:34.962"}
{"sender":"AD-IDFCFB-S","body":"Monthly interest of Rs.492.00 earned on your Savings A\/c XX6210 has been credited to your A\/C on 31\/12\/25. New bal: Rs.3,80,624.00. IDFC FIRST Bank","timestamp":1767272941377,"date":"2026-01-01 18:39:01.377"}
{"sender":"JD-SARLPK-P","body":"New Year Gift: Mangalam Industry Finance Ltd Spiking Up 20% Can Reach Rs 5\nCheck: https:\/\/vil.ltd\/SARLPK\/c\/BANR\nSarla Poly Pack","timestamp":1767247642647,"date":"2026-01-01 11:37:22.647"}
{"sender":"VM-LSMEAT-S","body":"Hi there!\nYour order 33klvooeinfx is on it's way and should arrive by 12:00 PM. Thanks for trusting Licious to bring you fresh, quality meals! \n- Licious","timestamp":1767247512136,"date":"2026-01-01 11:35:12.136"}
{"sender":"VM-HDFCBK-S","body":"Txn Rs.631.00\nOn HDFC Bank Card 7725\nAt cf.licious@cashfreensdlpb \nby UPI 767041647043\nOn 01-01\nNot You?\nCall 18002586161\/SMS BLOCK CC 7725 to 7308080808\n","timestamp":1767247246292,"date":"2026-01-01 11:30:46.292"}
{"sender":"VA-LSMEAT-S","body":"Hi there!\nYour order 33klvooeinfx will reach you in a FLASH by 12:00 PM. Thanks for choosing Licious! \n-Licious","timestamp":1767247244053,"date":"2026-01-01 11:30:44.053"}
{"sender":"VM-MYTNEU-S","body":"Hi, Licious has requested money from you on Tata Neu. On approving the request, Rs.631.00 will be debited from your account. To authorise, click on https:\/\/m.tneu.in\/MYTNEU\/4A060Ap or go to the Tata Pay UPI 'Approve Requests' section. - Team Tata Neu.","timestamp":1767247231355,"date":"2026-01-01 11:30:31.355"}
{"sender":"VM-LSMEAT-S","body":"Hi, \nAs per your request, your order wa02pjqawhlc has been cancelled. Any applicable refund will be credited to your original payment method -Licious","timestamp":1767247082391,"date":"2026-01-01 11:28:02.391"}
{"sender":"JX-HDFCBK-S","body":"Txn Rs.695.00\nOn HDFC Bank Card 7725\nAt licious@icici \nby UPI 108885072318\nOn 01-01\nNot You?\nCall 18002586161\/SMS BLOCK CC 7725 to 7308080808\n","timestamp":1767246966480,"date":"2026-01-01 11:26:06.480"}
{"sender":"VM-MYTNEU-S","body":"Hi, Licious has requested money from you on Tata Neu. On approving the request, Rs.695.00 will be debited from your account. To authorise, click on https:\/\/m.tneu.in\/MYTNEU\/BVwAvjL or go to the Tata Pay UPI 'Approve Requests' section. - Team Tata Neu.","timestamp":1767246955042,"date":"2026-01-01 11:25:55.042"}
{"sender":"JM-HDFCBK-S","body":"Available Bal in HDFC Bank A\/c XX2725 as on yesterday:31-DEC-25 is INR 3,19,951.78. Cheques are subject to clearing.For updated A\/C Bal dial 18002703333.","timestamp":1767234989527,"date":"2026-01-01 08:06:29.527"}
{"sender":"VM-HDFCBK-S","body":"Txn Rs.120.00\nOn HDFC Bank Card 7725\nAt gpay-12190328378@okbizaxis \nby UPI 573127198660\nOn 31-12\nNot You?\nCall 18002586161\/SMS BLOCK CC 7725 to 7308080808\n","timestamp":1767188167027,"date":"2025-12-31 19:06:07.027"}
{"sender":"AD-HDFCBK-S","body":"Sent Rs.2000.00\nFrom HDFC Bank A\/C *2725\nTo ZERODHA BROKING LIMITED\nOn 31\/12\/25\nRef 102338175504\nNot You?\nCall 18002586161\/SMS BLOCK UPI to 7308080808\n","timestamp":1767180748803,"date":"2025-12-31 17:02:28.803"}
{"sender":"AX-PHONPE-S","body":"ZERODHA BROKING LIMITED has requested money from you on PhonePe.Rs.2000 will be debited from your account on approving the request - https:\/\/phone.pe\/PHONPE\/uoqghh4b","timestamp":1767180743641,"date":"2025-12-31 17:02:23.641"}
{"sender":"JD-HDFCBK-S","body":"HDFC Bank Cardmember, Online Payment of Rs.2970 vide Ref# 364174214e5RzSN was credited to your card ending 3838 On 30\/DEC\/2025_value Date 30\/DEC\/2025","timestamp":1767179281174,"date":"2025-12-31 16:38:01.174"}
{"sender":"JM-HDFCBK-S","body":"HDFC Bank Cardmember, Online Payment of Rs.1893 vide Ref# 364174143VpEBi2 was credited to your card ending 7725 On 30\/DEC\/2025_value Date 30\/DEC\/2025","timestamp":1767179239048,"date":"2025-12-31 16:37:19.048"}
{"sender":"AD-HDFCBK-S","body":"Txn Rs.100.00\nOn HDFC Bank Card 7725\nAt paytmqr6mqyk9@ptys \nby UPI 573128095783\nOn 31-12\nNot You?\nCall 18002586161\/SMS BLOCK CC 7725 to 7308080808\n","timestamp":1767162934720,"date":"2025-12-31 12:05:34.720"}
{"sender":"AD-HDFCBK-S","body":"Credit Alert!\nRs.20000.00 credited to HDFC Bank A\/c XX2725 on 31-12-25 from VPA 9618809138@ybl (UPI 153187631481)\n","timestamp":1767162714234,"date":"2025-12-31 12:01:54.234"}
{"sender":"JM-HDFCBK-S","body":"Available Bal in HDFC Bank A\/c XX2725 as on yesterday:30-DEC-25 is INR 3,01,577.78. Cheques are subject to clearing.For updated A\/C Bal dial 18002703333.","timestamp":1767145348283,"date":"2025-12-31 07:12:28.283"}
{"sender":"JM-ICICIT-S","body":"Payment of Rs 5,296.00 has been received on your ICICI Bank Credit Card XX2008 through Bharat Bill Payment System on 30-DEC-25.","timestamp":1767097670999,"date":"2025-12-30 17:57:50.999"}
{"sender":"VM-HDFCBK-S","body":"Sent Rs.100000.00\nFrom HDFC Bank A\/C *2725\nTo Saikumar Reddy Godala\nOn 30\/12\/26\nRef 573003978888\nNot You?\nCall 18002586161\/SMS BLOCK UPI to 7308080808\n","timestamp":1767096981361,"date":"2025-12-30 17:46:21.361"}
{"sender":"AD-IDFCFB-S","body":"Your A\/C XXXXX286210 is credited with INR 1,00,000.00 on 30\/12\/25 17:46. Your new balance is INR 3,80,132.00. Team IDFC FIRST Bank","timestamp":1767096979727,"date":"2025-12-30 17:46:19.727"}
{"sender":"AD-ICICIT-S","body":"ICICI Bank Acct XX294 debited for Rs 100000.00 on 30-Dec-25; Saikumar Reddy  credited. UPI:573003978672. Call 18002662 for dispute. SMS BLOCK 294 to 9215676766.","timestamp":1767096907559,"date":"2025-12-30 17:45:07.559"}
{"sender":"JD-IDFCFB-S","body":"Your A\/C XXXXX286210 is credited with INR 1,00,000.00 on 30\/12\/25 17:45. Your new balance is INR 2,80,132.00. Team IDFC FIRST Bank","timestamp":1767096906779,"date":"2025-12-30 17:45:06.779"}
{"sender":"AD-SBICRD-S","body":"We have received payment of Rs.1,659.60 via BBPS & the same has been credited to your SBI Credit Card. Your available limit is Rs.225,079.02.","timestamp":1767096762703,"date":"2025-12-30 17:42:42.703"}
{"sender":"VM-HDFCBK-S","body":"Sent Rs.1659.60\nFrom HDFC Bank A\/C *2725\nTo CRED Club\nOn 30\/12\/26\nRef 573015987389\nNot You?\nCall 18002586161\/SMS BLOCK UPI to 7308080808\n","timestamp":1767096760779,"date":"2025-12-30 17:42:40.779"}
{"sender":"JM-HDFCBK-S","body":"DEAR HDFCBANK CARDMEMBER, PAYMENT OF Rs. 2970.00 RECEIVED TOWARDS YOUR CREDIT CARD ENDING WITH 3838 ON 30-12-2025.YOUR AVAILABLE LIMIT IS RS. 447178.05","timestamp":1767096737670,"date":"2025-12-30 17:42:17.670"}
{"sender":"VM-HDFCBK-S","body":"Sent Rs.2970.00\nFrom HDFC Bank A\/C *2725\nTo CRED Club\nOn 30\/12\/26\nRef 573029980640\nNot You?\nCall 18002586161\/SMS BLOCK UPI to 7308080808\n","timestamp":1767096736540,"date":"2025-12-30 17:42:16.540"}
{"sender":"VM-HDFCBK-S","body":"Sent Rs.5296.00\nFrom HDFC Bank A\/C *2725\nTo CRED Club\nOn 30\/12\/26\nRef 573027987196\nNot You?\nCall 18002586161\/SMS BLOCK UPI to 7308080808\n","timestamp":1767096723720,"date":"2025-12-30 17:42:03.720"}
{"sender":"AD-HDFCBK-S","body":"DEAR HDFCBANK CARDMEMBER, PAYMENT OF Rs. 1893.00 RECEIVED TOWARDS YOUR CREDIT CARD ENDING WITH 7725 ON 30-12-2025.YOUR AVAILABLE LIMIT IS RS. 447993.25","timestamp":1767096705279,"date":"2025-12-30 17:41:45.279"}
{"sender":"AD-HDFCBK-S","body":"Sent Rs.1892.00\nFrom HDFC Bank A\/C *2725\nTo CRED Club\nOn 30\/12\/26\nRef 573003978013\nNot You?\nCall 18002586161\/SMS BLOCK UPI to 7308080808\n","timestamp":1767096703262,"date":"2025-12-30 17:41:43.262"}
{"sender":"AX-CRIFHM-S","body":"Your CRIF Credit Report CCR251230CR704701257 is generated through AIRTEL with your consent.This is a soft inquiry & doesn't impact your credit score. If you need any further information, please reach out to crifcare@crifhighmark.com","timestamp":1767096536093,"date":"2025-12-30 17:38:56.093"}
{"sender":"AD-AIRBIL-S","body":"Hi Godala Saikumar Reddy, we have received a payment of Rs. 2357.64 for your Airtel Wi-Fi ID 04010448295_dsl.\nTo download the payment receipt, click https:\/\/digi-api.airtel.in\/raas\/fetch?key=402c3823076a08455ea815e714b9227e75d039706c554f34e32fac028c85f095 . This receipt will be available to download for 7 days.","timestamp":1767096507405,"date":"2025-12-30 17:38:27.405"}
{"sender":"AA-AIRINF","body":"Hi, we have processed Rs. 2357.64 for your Airtel Wi-Fi ID 04010448295_dsl. The payment will be updated within 5 minutes. Please keep your order ID 7411739801023455232 for future reference. Track your payment status via  https:\/\/i.airtel.in\/Recharge-Bills","timestamp":1767096502699,"date":"2025-12-30 17:38:22.699"}
{"sender":"JM-HDFCBK-S","body":"Update! INR 1,92,703.00 deposited in HDFC Bank A\/c XX2725 on 30-DEC-25 for NEFT Cr-BOFA0CN6215-OPEN TEXT TECHNOLOGIES INDIA PVT-GODALA SAIKUMAR REDDY-BOFAH25364056225.Avl bal INR 4,13,395.38. Cheque deposits in A\/C are subject to clearing","timestamp":1767089093737,"date":"2025-12-30 15:34:53.737"}
{"sender":"JM-HDFCBK-S","body":"Available Bal in HDFC Bank A\/c XX2725 as on yesterday:29-DEC-25 is INR 2,20,692.38. Cheques are subject to clearing.For updated A\/C Bal dial 18002703333.","timestamp":1767060074121,"date":"2025-12-30 07:31:14.121"}
{"sender":"CP-POPEYE-S","body":"We hope you enjoyed your Popeyes meal. Can you please take a moment and rate your food and experience with us? Please click https:\/\/popin.jfl.fyi\/POPEYE\/mRRjlIY to share your valuable feedback.","timestamp":1767008496104,"date":"2025-12-29 17:11:36.104"}
{"sender":"VK-POPEYE-S","body":"Dear guest, your Popeyes order is out for delivery. Click on https:\/\/popin.jfl.fyi\/POPEYE\/2A2mkY3 to track it.","timestamp":1767008017415,"date":"2025-12-29 17:03:37.415"}
{"sender":"VK-POPEYE-S","body":"Enjoy delicious Popeyes food! Your order no is 18. Click https:\/\/popin.jfl.fyi\/POPEYE\/N2k2mNU for your e-invoice.","timestamp":1767006068170,"date":"2025-12-29 16:31:08.170"}
{"sender":"VK-POPEYE-S","body":"Thanks for choosing Popeyes! Delicious food is arriving at your doorstep  at the earliest|Order no. 18 |Amount:Rs. 314.00 |Track order@ https:\/\/m.popeyes.in\/track","timestamp":1767006066713,"date":"2025-12-29 16:31:06.713"}
{"sender":"JD-HDFCBK-S","body":"Txn Rs.314.00\nOn HDFC Bank Card 7725\nAt paytm-66845969@ptybl \nby UPI 108864960650\nOn 29-12\nNot You?\nCall 18002586161\/SMS BLOCK CC 7725 to 7308080808\n","timestamp":1767006060081,"date":"2025-12-29 16:31:00.081"}
{"sender":"VM-HDFCBK-S","body":"Txn Rs.60.00\nOn HDFC Bank Card 7725\nAt paytmqr5y5ac5@ptys \nby UPI 572928743946\nOn 29-12\nNot You?\nCall 18002586161\/SMS BLOCK CC 7725 to 7308080808\n","timestamp":1766981526916,"date":"2025-12-29 09:42:06.916"}
{"sender":"JX-HDFCBK-S","body":"Sent Rs.52.00\nFrom HDFC Bank A\/C *2725\nTo A MANOHARACHARI\nOn 29\/12\/26\nRef 572929747558\nNot You?\nCall 18002586161\/SMS BLOCK UPI to 7308080808\n","timestamp":1766981321731,"date":"2025-12-29 09:38:41.731"}
{"sender":"JX-ICICIT-S","body":"Payment of Rs 6,709.00 has been received on your ICICI Bank Credit Card XX0006 through Bharat Bill Payment System on 29-DEC-25.","timestamp":1766977047653,"date":"2025-12-29 08:27:27.653"}
{"sender":"VM-HDFCBK-S","body":"Sent Rs.6701.00\nFrom HDFC Bank A\/C *2725\nTo CRED Club\nOn 29\/12\/26\nRef 572903736647\nNot You?\nCall 18002586161\/SMS BLOCK UPI to 7308080808\n","timestamp":1766976497489,"date":"2025-12-29 08:18:17.489"}
{"sender":"VM-RBISAY-G","body":"మీ KYC ను నవీకరించండి. KYC లో ఎటువంటి మార్పు లేకపోతే లేదా చిరునామాలో మాత్రమే మార్పు ఉంటే, బ్యాంకు శాఖకు లేదా BC \/ నెట్ బ్యాంకింగ్ \/ మొబైల్ యాప్ \/ వీడియో KYC ద్వారా స్వీయ ప్రకటన సమర్పించండి. -RBI","timestamp":1766915618188,"date":"2025-12-28 15:23:38.188"}
{"sender":"AD-AXISBK-S","body":"Spent INR 185\nAxis Bank Card no. XX8887\n28-12-25 14:43:48 IST\nPYU*Swiggy\nAvl Limit: INR 298859\nNot you? SMS BLOCK 8887 to 919951860002","timestamp":1766913234821,"date":"2025-12-28 14:43:54.821"}
{"sender":"VK-RBISAY-G","body":"మీ KYC ను నవీకరించండి. KYC లో ఎటువంటి మార్పు లేకపోతే లేదా చిరునామాలో మాత్రమే మార్పు ఉంటే, బ్యాంకు శాఖకు లేదా BC \/ నెట్ బ్యాంకింగ్ \/ మొబైల్ యాప్ \/ వీడియో KYC ద్వారా స్వీయ ప్రకటన సమర్పించండి. -RBI","timestamp":1766904961081,"date":"2025-12-28 12:26:01.081"}
{"sender":"AD-HDFCBK-S","body":"Txn Rs.60.00\nOn HDFC Bank Card 7725\nAt vyapar.173809273543@hdfcbank \nby UPI 572830598887\nOn 28-12\nNot You?\nCall 18002586161\/SMS BLOCK CC 7725 to 7308080808\n","timestamp":1766897323650,"date":"2025-12-28 10:18:43.650"}
{"sender":"JM-HDFCBK-S","body":"Available Bal in HDFC Bank A\/c XX2725 as on yesterday:27-DEC-25 is INR 2,27,445.38. Cheques are subject to clearing.For updated A\/C Bal dial 18002703333.","timestamp":1766887541197,"date":"2025-12-28 07:35:41.197"}
{"sender":"VM-HDFCBK-S","body":"Txn Rs.20.00\nOn HDFC Bank Card 7725\nAt q550433852@ybl \nby UPI 572719557418\nOn 27-12\nNot You?\nCall 18002586161\/SMS BLOCK CC 7725 to 7308080808\n","timestamp":1766850557398,"date":"2025-12-27 21:19:17.398"}
{"sender":"VM-HDFCBK-S","body":"Sent Rs.550.00\nFrom HDFC Bank A\/C *2725\nTo MAHARAJA CHAT AND FOODS\nOn 27\/12\/25\nRef 572725558391\nNot You?\nCall 18002586161\/SMS BLOCK UPI to 7308080808\n","timestamp":1766849037844,"date":"2025-12-27 20:53:57.844"}
{"sender":"AD-HDFCBK-S","body":"Sent Rs.32.00\nFrom HDFC Bank A\/C *2725\nTo A MANOHARACHARI\nOn 27\/12\/25\nRef 572716504370\nNot You?\nCall 18002586161\/SMS BLOCK UPI to 7308080808\n","timestamp":1766833276278,"date":"2025-12-27 16:31:16.278"}
{"sender":"JM-ICICIT-S","body":"INR 704.00 spent using ICICI Bank Card XX0006 on 27-Dec-25 on AMAZON PAY IN E. Avl Limit: INR 7,07,290.94. If not you, call 1800 2662\/SMS BLOCK 0006 to 9215676766.","timestamp":1766830831344,"date":"2025-12-27 15:50:31.344"}
{"sender":"JM-HDFCBK-S","body":"Spent Rs.174.75 On HDFC Bank Card 7725 At ZOMATO                new On 2025-12-27:10:18:36.Not You? To Block+Reissue Call 18002586161\/SMS BLOCK CC 7725 to 7308080808","timestamp":1766810926048,"date":"2025-12-27 10:18:46.048"}
{"sender":"AD-AIRBIL-S","body":"Hi GodalaSaikumar Reddy, Airtel Black bill for your registered number 8185930454 dated 27-Dec-2025 has been generated. Details below -\n\nCurrent Month Payable Amount: Rs 2357.64 (Inclusive of tax)\nDue By: 06-Jan-26\n\nBill Summary\nThis month Plan Rental: Rs 1998.00\nTax: Rs 359.64\nThis Month total charges: Rs 2357.64\n\nTo view bill breakup & pay, click - i.airtel.in\/bill_landing\nTo understand your bill click https:\/\/gh0hi-web.app.link\/e\/ACYT-UABB","timestamp":1766796349077,"date":"2025-12-27 06:15:49.077"}
{"sender":"VM-HDFCBK-S","body":"Txn Rs.220.00\nOn HDFC Bank Card 7725\nAt gameonlevelupyourfun.63978483@hdfcbank \nby UPI 572617403857\nOn 26-12\nNot You?\nCall 18002586161\/SMS BLOCK CC 7725 to 7308080808\n","timestamp":1766761900624,"date":"2025-12-26 20:41:40.624"}
{"sender":"AD-SBICRD-S","body":"Rs.2,000.00 spent on your SBI Credit Card ending 2983 at GAMEONLEVELUPYOURF on 26\/12\/25. Trxn. not done by you? Report at https:\/\/sbicard.com\/Dispute","timestamp":1766761462516,"date":"2025-12-26 20:34:22.516"}
{"sender":"CP-NSETRA-S","body":"Dear CUZXXXXX0G,Your traded value for 26-DEC-25 CM Rs 100799.78 Check your registered email. For details contact broker -National Stock Exchange.","timestamp":1766759944777,"date":"2025-12-26 20:09:04.777"}
{"sender":"AD-SBICRD-S","body":"Dear Cardholder, with the Balance Transfer on EMI facility on your credit card, you can avoid high interest rates! Simply transfer your other bank credit card's outstanding to your SBI Credit Card and pay in easy EMIs. Visit https:\/\/app.sbicard.com\/SBICRD\/BTEMI - SBI Card","timestamp":1766750745402,"date":"2025-12-26 17:35:45.402"}
{"sender":"AD-SSFBLT-S","body":"Beware of fake challan messages! Do not click on unknown APK links in SMS\/WhatsApp. Verify challans only on official Government websites\/apps. - Shivalik Bank","timestamp":1766741412394,"date":"2025-12-26 15:00:12.394"}
{"sender":"JX-BAJET-P","body":"Dear Client,\n\nMangalam Industrial Finance is flying like rocket for Target Rs 5 Now at Rs 1\nCheck Details: https:\/\/vil.ltd\/BANERJ\/c\/MGLM\n\nBanerjee Enterprises","timestamp":1766740526929,"date":"2025-12-26 14:45:26.929"}
{"sender":"JD-IDFCFB-S","body":"The eStatement for your FIRST Select Credit Card XX4969 is here https:\/\/idfcfr.in\/IDFCFB\/Ye2c3v\nTo access eStatement use your date of birth in DDMM format\nPayment Due by 08-01-2026\nMin Due: INR 0.00\nTotal Due: INR 0.00\nClick to pay: https:\/\/idfcfr.in\/IDFCFB\/0gv9WO\nIDFC FIRST Bank","timestamp":1766733035386,"date":"2025-12-26 12:40:35.386"}
{"sender":"JM-HDFCBN-S","body":"Dear Customer, based on your HDFC Bank Credit Card usage, a loan facility has been enabled.\nReview details: https:\/\/hdfcbk.io\/HDFCBK\/s\/VylZB9A3\nT&C","timestamp":1766723795844,"date":"2025-12-26 10:06:35.844"}
{"sender":"JD-HDFCBK-S","body":"Available Bal in HDFC Bank A\/c XX2725 as on yesterday:25-DEC-25 is INR 2,28,027.38. Cheques are subject to clearing.For updated A\/C Bal dial 18002703333.","timestamp":1766715579410,"date":"2025-12-26 07:49:39.410"}
{"sender":"JX-HDFCBK-S","body":"UPI Mandate Cancelled\nTowards Google Play\nFor Rs. 3599.00\nFrom HDFC Bank A\/c X2725\nUMN 45a98ea415d14ae99ce190e65bba12af@ybl\n","timestamp":1766674842275,"date":"2025-12-25 20:30:42.275"}
{"sender":"VM-EPFOHO-G","body":"Dear XXXXXXXX8475, your passbook balance against PUPUN**************4737 is Rs. 1,99,542\/-. Contribution of Rs. 2,350\/- for due month Dec-25 has been received.","timestamp":1766671510349,"date":"2025-12-25 19:35:10.349"}
{"sender":"JD-620040-P","body":"You're one step away! Claim FREE 18-month Google Gemini Pro plan worth Rs.35100. Get 2000 GB cloud storage to keep every favorite memory safe forever. Claim now https:\/\/www.jio.com\/dl\/sms-cn-ggo . Jio T&C apply","timestamp":1766663320977,"date":"2025-12-25 17:18:40.977"}
{"sender":"JX-CINPLS-P","body":"Hey! Just 7 days left! Get 50% off up to 150 on movie tickets. Use code TIMEMHFNNU and book now http:\/\/nmc.sg\/CINPLS\/lcvjGE -Cinepolis India Pvt Ltd","timestamp":1766660304307,"date":"2025-12-25 16:28:24.307"}
{"sender":"JM-ICICIT-S","body":"ICICI Bank Credit Card XX2008 Statement is sent to go**********ar@gmail.com. Total of Rs 329.00 or minimum of Rs 100.00 is due by 05-JAN-26.","timestamp":1766659714026,"date":"2025-12-25 16:18:34.026"}
{"sender":"VM-HDFCBK-S","body":"Sent Rs.50.00\nFrom HDFC Bank A\/C *2725\nTo A MANOHARACHARI\nOn 25\/12\/25\nRef 572507150624\nNot You?\nCall 18002586161\/SMS BLOCK UPI to 7308080808\n","timestamp":1766646578597,"date":"2025-12-25 12:39:38.597"}
{"sender":"VM-HDFCBK-S","body":"Txn Rs.125.00\nOn HDFC Bank Card 7725\nAt q873033518@ybl \nby UPI 572531157221\nOn 25-12\nNot You?\nCall 18002586161\/SMS BLOCK CC 7725 to 7308080808\n","timestamp":1766646452593,"date":"2025-12-25 12:37:32.593"}
{"sender":"VM-HDFCBK-S","body":"Sent Rs.20000.00\nFrom HDFC Bank A\/C *2725\nTo ZERODHA BROKING LIMITED\nOn 25\/12\/25\nRef 572530148791\nNot You?\nCall 18002586161\/SMS BLOCK UPI to 7308080808\n","timestamp":1766644847906,"date":"2025-12-25 12:10:47.906"}
{"sender":"JX-HDFCBK-S","body":"Sent Rs.90000.00\nFrom HDFC Bank A\/C *2725\nTo ZERODHA BROKING LIMITED\nOn 25\/12\/25\nRef 572527153213\nNot You?\nCall 18002586161\/SMS BLOCK UPI to 7308080808\n","timestamp":1766644823622,"date":"2025-12-25 12:10:23.622"}
{"sender":"AX-PHONPE-S","body":"ZERODHA BROKING LTD has requested money from you on PhonePe.Rs.110000 will be debited from your account on approving the request - https:\/\/phone.pe\/PHONPE\/5tie4dh7","timestamp":1766644755052,"date":"2025-12-25 12:09:15.052"}
{"sender":"VM-HDFCBK-S","body":"Credit Alert!\nRs.50000.00 credited to HDFC Bank A\/c XX2725 on 25-12-25 from VPA 9505458713@ybl (UPI 516678001122)\n","timestamp":1766643382382,"date":"2025-12-25 11:46:22.382"}
{"sender":"AD-SBICRD-S","body":"Rs.170.00 spent on your SBI Credit Card ending 2983 at PRASADS on 24\/12\/25. Trxn. not done by you? Report at https:\/\/sbicard.com\/Dispute","timestamp":1766566447528,"date":"2025-12-24 14:24:07.528"}
{"sender":"VM-HDFCBK-S","body":"Txn Rs.20.00\nOn HDFC Bank Card 7725\nAt paytm.s1gyxly@pty \nby UPI 572412977898\nOn 24-12\nNot You?\nCall 18002586161\/SMS BLOCK CC 7725 to 7308080808\n","timestamp":1766554545264,"date":"2025-12-24 11:05:45.264"}
{"sender":"JM-HDFCBN-S","body":"Dear Customer,\nThank you for banking with HDFC Bank. Your A\/c is pre-approved for a Personal Loan.\nCheck details: https:\/\/hdfcbk.io\/HDFCBK\/s\/9yY9qPpX\nT&C","timestamp":1766551256832,"date":"2025-12-24 10:10:56.832"}
{"sender":"AD-BMSHOW-S","body":"Confirmed! Booking ID WJ4MHFN\nClick for ticket\/s, offers and details:https:\/\/in.bookmyshow.com\/BMSTNY\/yyr15p4GNN\n- BookMyShow","timestamp":1766547546342,"date":"2025-12-24 09:09:06.342"}
{"sender":"JD-HDFCBK-S","body":"Available Bal in HDFC Bank A\/c XX2725 as on yesterday:23-DEC-25 is INR 2,88,077.38. Cheques are subject to clearing.For updated A\/C Bal dial 18002703333.","timestamp":1766543460925,"date":"2025-12-24 08:01:00.925"}
{"sender":"AA-AIRINF-S","body":"Dear airtelThanks member, your Apple music subscription has been cancelled. Check out other benefits for your number at airtel.in\/5\/thanksben","timestamp":1766533705473,"date":"2025-12-24 05:18:25.473"}
{"sender":"AA-AIRINF-S","body":"Dear airtelThanks member, your Google One subscription has been cancelled. Check out other benefits for your number at airtel.in\/5\/thanksben","timestamp":1766525533960,"date":"2025-12-24 03:02:13.960"}
{"sender":"JX-620040-P","body":"You're one step away! Claim FREE 18-month Google Gemini Pro plan worth Rs.35100. Turn your ideas into high-quality videos instantly with Veo 3.1. Claim now https:\/\/www.jio.com\/dl\/sms-cn-ggo . Jio T&C apply.","timestamp":1766492151674,"date":"2025-12-23 17:45:51.674"}
{"sender":"VM-HDFCBK-S","body":"Credit Alert!\nRs.255.00 credited to HDFC Bank A\/c XX2725 on 23-12-25 from VPA 8555892971@ibl (UPI 810639061732)\n","timestamp":1766466646574,"date":"2025-12-23 10:40:46.574"}
{"sender":"VM-HDFCBK-S","body":"Credit Alert!\nRs.860.00 credited to HDFC Bank A\/c XX2725 on 23-12-25 from VPA komalivankayala@okaxis (UPI 535734890332)\n","timestamp":1766465827298,"date":"2025-12-23 10:27:07.298"}
{"sender":"AX-ICICIT-S","body":"INR 904.00 spent using ICICI Bank Card XX0006 on 23-Dec-25 on AMAZON PAY IN E. Avl Limit: INR 7,08,698.94. If not you, call 1800 2662\/SMS BLOCK 0006 to 9215676766.","timestamp":1766465663339,"date":"2025-12-23 10:24:23.339"}
{"sender":"JM-ICICIT-S","body":"INR 199.00 spent using ICICI Bank Card XX0006 on 23-Dec-25 on NETFLIX. Avl Limit: INR 7,09,602.94. If not you, call 1800 2662\/SMS BLOCK 0006 to 9215676766.","timestamp":1766458069455,"date":"2025-12-23 08:17:49.455"}
{"sender":"JD-ICICIT-S","body":"Dear Customer, we have successfully processed the payment of INR 199.00 for NETFLIX, as per the Standing Instruction XI0YTidAvD, on 23\/12\/2025 for your ICICI Bank Credit Card 0006. To manage your Standing Instructions, visit www.icicibank.com >Cards >Credit Cards>Standing Instructions and Recurring Charges>Manage Standing Instructions.","timestamp":1766458068787,"date":"2025-12-23 08:17:48.787"}
{"sender":"CP-HDFCBK-S","body":"Available Bal in HDFC Bank A\/c XX2725 as on yesterday:22-DEC-25 is INR 2,86,962.38. Cheques are subject to clearing.For updated A\/C Bal dial 18002703333.","timestamp":1766457338248,"date":"2025-12-23 08:05:38.248"}
{"sender":"AD-AIRTEL-S","body":"Hi, Apple Music subscription with your Airtel Postpaid 8185930454 is due for renewal today. You'll be charged Rs 119 for 1 month in your next bill. To manage, click www.airtel.in\/5\/airtelthanks","timestamp":1766401474566,"date":"2025-12-22 16:34:34.566"}
{"sender":"AX-ICICIT-S","body":"ICICI Bank Acct XX294 debited for Rs 50.00 on 22-Dec-25; A MANOHARACHARI credited. UPI:572858757088. Call 18002662 for dispute. SMS BLOCK 294 to 9215676766.","timestamp":1766391422942,"date":"2025-12-22 13:47:02.942"}
{"sender":"JD-ICICIT-S","body":"Payment of Rs 329.00 has been received on your ICICI Bank Credit Card XX2008 through Bharat Bill Payment System on 22-DEC-25.","timestamp":1766377948878,"date":"2025-12-22 10:02:28.878"}
{"sender":"VM-HDFCBK-S","body":"Sent Rs.29000.00\nFrom HDFC Bank A\/C *2725\nTo ICCL ZERODHA\nOn 22\/12\/25\nRef 102273473281\nNot You?\nCall 18002586161\/SMS BLOCK UPI to 7308080808\n","timestamp":1766376649566,"date":"2025-12-22 09:40:49.566"}
{"sender":"AX-PHONPE-S","body":"ICCL ZERODHA has requested money from you on PhonePe.Rs.29000 will be debited from your account on approving the request - https:\/\/phone.pe\/PHONPE\/14nawkst","timestamp":1766376635480,"date":"2025-12-22 09:40:35.480"}
{"sender":"VM-HDFCBK-S","body":"Sent Rs.2000.00\nFrom HDFC Bank A\/C *2725\nTo ICCL ZERODHA\nOn 22\/12\/25\nRef 102273466446\nNot You?\nCall 18002586161\/SMS BLOCK UPI to 7308080808\n","timestamp":1766376553541,"date":"2025-12-22 09:39:13.541"}
{"sender":"AX-PHONPE-S","body":"ICCL ZERODHA has requested money from you on PhonePe.Rs.2000 will be debited from your account on approving the request - https:\/\/phone.pe\/PHONPE\/rk7sdg3x","timestamp":1766376535685,"date":"2025-12-22 09:38:55.685"}
{"sender":"VM-HDFCBK-S","body":"Sent Rs.100.00\nFrom HDFC Bank A\/C *2725\nTo ICCL ZERODHA\nOn 22\/12\/25\nRef 102273461976\nNot You?\nCall 18002586161\/SMS BLOCK UPI to 7308080808\n","timestamp":1766376505556,"date":"2025-12-22 09:38:25.556"}
{"sender":"JX-PHONPE-S","body":"ICCL ZERODHA has requested money from you on PhonePe.Rs.100 will be debited from your account on approving the request - https:\/\/phone.pe\/PHONPE\/fti6ddqm","timestamp":1766376499861,"date":"2025-12-22 09:38:19.861"}
{"sender":"VM-HDFCBK-S","body":"Sent Rs.50000.00\nFrom HDFC Bank A\/C *2725\nTo ICCL ZERODHA\nOn 22\/12\/25\nRef 102273455947\nNot You?\nCall 18002586161\/SMS BLOCK UPI to 7308080808\n","timestamp":1766376454996,"date":"2025-12-22 09:37:34.996"}
{"sender":"JD-PHONPE-S","body":"ICCL ZERODHA has requested money from you on PhonePe.Rs.50000 will be debited from your account on approving the request - https:\/\/phone.pe\/PHONPE\/pou9ttik","timestamp":1766376434556,"date":"2025-12-22 09:37:14.556"}
{"sender":"VM-HDFCBK-S","body":"Sent Rs.327.00\nFrom HDFC Bank A\/C *2725\nTo CRED Club\nOn 22\/12\/25\nRef 572212663095\nNot You?\nCall 18002586161\/SMS BLOCK UPI to 7308080808\n","timestamp":1766376194302,"date":"2025-12-22 09:33:14.302"}
{"sender":"CP-HDFCBK-S","body":"Update! INR 79,945.98 deposited in HDFC Bank A\/c XX2725 on 22-DEC-25 for FT- 2334233915-XXXXXXXXXX9159 - INDIAN CLEARING CORPORATION LIMITED -.Avl bal INR 3,68,389.38. Cheque deposits in A\/C are subject to clearing","timestamp":1766374268577,"date":"2025-12-22 09:01:08.577"}
{"sender":"CP-HDFCBK-S","body":"Update! INR 2,35,357.60 deposited in HDFC Bank A\/c XX2725 on 22-DEC-25 for FT- 2334228453-XXXXXXXXXX9159 - INDIAN CLEARING CORPORATION LIMITED -.Avl bal INR 2,88,443.40. Cheque deposits in A\/C are subject to clearing","timestamp":1766374234743,"date":"2025-12-22 09:00:34.743"}
{"sender":"AA-AIRINF-S","body":"Hi, your Apple Music subscription is about to end. Rs. 119 will be added to your Airtel bill in 3 days as payment for Apple Music. To opt out, please visit Airtel Thanks App i.airtel.in\/thanks","timestamp":1766316370695,"date":"2025-12-21 16:56:10.695"}
{"sender":"JA-JIOVOC-S","body":"Dear Customer, Click www.jio.com\/r\/CxoX2hwwT to tell us how we can make your experience on Jio network even better. Thank you, Team Jio","timestamp":1766306485340,"date":"2025-12-21 14:11:25.340"}
{"sender":"AX-ICICIT-S","body":"Rs 5,296.06 spent on ICICI Bank Card XX2008 on 21-Dec-25 at AVENUE SUPERMAR. Avl Lmt: Rs 7,09,472.94. To dispute, call 18002662\/SMS BLOCK 2008 to 9215676766. To convert this txn to EMI give a missed call on 9924667667. Know more about EMI conversion at https:\/\/icici.co\/ICICIT\/ar\/16pfU5K","timestamp":1766299513345,"date":"2025-12-21 12:15:13.345"}
{"sender":"VM-HDFCBK-S","body":"Txn Rs.750.00\nOn HDFC Bank Card 7725\nAt priveplex734888.rzp@rxaxis \nby UPI 947809988292\nOn 21-12\nNot You?\nCall 18002586161\/SMS BLOCK CC 7725 to 7308080808\n","timestamp":1766295997868,"date":"2025-12-21 11:16:37.868"}
{"sender":"VM-PVRVIP-P","body":"AVATAR: Fire & Ash explodes in 4DX with motion, wind, & effects that pull you straight into the war. Book Now at PVR - https:\/\/c.pvrdm.in\/PVRVIP\/fgWVpXCJ0","timestamp":1766294014002,"date":"2025-12-21 10:43:34.002"}
{"sender":"CP-HDFCBK-S","body":"Available Bal in HDFC Bank A\/c XX2725 as on yesterday:20-DEC-25 is INR 53,085.80. Cheques are subject to clearing.For updated A\/C Bal dial 18002703333.","timestamp":1766283113169,"date":"2025-12-21 07:41:53.169"}
{"sender":"AD-HDFCBK-S","body":"Sent Rs.1154.83\nFrom HDFC Bank A\/C *2725\nTo Adhoc Sivam Auto Hitec\nOn 20\/12\/25\nRef 572003402531\nNot You?\nCall 18002586161\/SMS BLOCK UPI to 7308080808\n","timestamp":1766227679155,"date":"2025-12-20 16:17:59.155"}
{"sender":"VM-HDFCBK-S","body":"Sent Rs.20000.00\nFrom HDFC Bank A\/C *2725\nTo SHIVA KRISHNA NALUMASU\nOn 20\/12\/25\nRef 483934095101\nNot You?\nCall 18002586161\/SMS BLOCK UPI to 7308080808\n","timestamp":1766227427391,"date":"2025-12-20 16:13:47.391"}
{"sender":"AD-HDFCBK-S","body":"Spent Rs.2895.6 On HDFC Bank Card 3838 At ZOMATO11120 On 2025-12-20:15:55:49.Not You? To Block+Reissue Call 18002586161\/SMS BLOCK CC 3838 to 7308080808","timestamp":1766226357811,"date":"2025-12-20 15:55:57.811"}
{"sender":"JD-CINPLS-P","body":"Hey, long time no see! Enjoy 50% off up to 150 at Cinepolis. Use code TIMEMHFNNU Book now http:\/\/nmc.sg\/CINPLS\/l2RTQu -Cinepolis India Pvt Ltd","timestamp":1766223240500,"date":"2025-12-20 15:04:00.500"}
{"sender":"VM-TNUCRD-S","body":"Important update Godala, We have credited 433 NeuCoins based on your latest NeuCard statement. Check your dashboard for referral benefits https:\/\/m.tneu.in\/TNUCRD\/g2rKyP2 Tata Neu","timestamp":1766221957150,"date":"2025-12-20 14:42:37.150"}
{"sender":"CP-blnkit-P","body":"Hyderabad, enjoy FREE delivery on all orders above Rs.149. Get groceries, munchies & more in 10 mins. Order:https:\/\/blinkit.to\/blnkit\/z\/r7bfjo13 -blinkit","timestamp":1766214354839,"date":"2025-12-20 12:35:54.839"}
{"sender":"JD-ZOMATO-S","body":"Zomato Dining: Slot booked for 01:30PM, 20 Dec, for 3 people.\nCheck out booking details: zoma.to\/ZOMATO\/zm\/do\/99235611480 -ZOMATO","timestamp":1766212557472,"date":"2025-12-20 12:05:57.472"}
{"sender":"AD-HDFCBK-S","body":"Spent Rs.75 On HDFC Bank Card 3838 At ZOMATO11120 On 2025-12-20:12:05:41.Not You? To Block+Reissue Call 18002586161\/SMS BLOCK CC 3838 to 7308080808","timestamp":1766212547657,"date":"2025-12-20 12:05:47.657"}
{"sender":"JX-YESBNK-S","body":"Dear Customer, registration for ICCLZERODHA has started for YES BANK. If it was not you, report to your bank. Do not share card details\/OTP\/CVV with anyone.","timestamp":1766208070983,"date":"2025-12-20 10:51:10.983"}
{"sender":"+918291057570","body":"YESPRODUPI ppsj81)dV?Q317zCVI*kn&oR!TWJ3tATEU!9G +918291057570","timestamp":1766208069243,"date":"2025-12-20 10:51:09.243"}
{"sender":"CP-IDFCFB-S","body":"We are unable to process your credit card application no.0441647976  as you already have an IDFC FIRST Bank Credit Card or have another application in progress.","timestamp":1766207849794,"date":"2025-12-20 10:47:29.794"}
{"sender":"AD-AXISBK-S","body":"Spent INR 364\nAxis Bank Card no. XX8887\n20-12-25 00:49:48 IST\nRazorpay*Sw\nAvl Limit: INR 299044\nNot you? SMS BLOCK 8887 to 919951860002","timestamp":1766171992802,"date":"2025-12-20 00:49:52.802"}
{"sender":"VM-HDFCBK-S","body":"Txn Rs.20.00\nOn HDFC Bank Card 7725\nAt q462284511@ybl \nby UPI 571912293378\nOn 19-12\nNot You?\nCall 18002586161\/SMS BLOCK CC 7725 to 7308080808\n","timestamp":1766155792971,"date":"2025-12-19 20:19:52.971"}
{"sender":"+919573724969","body":"Free ayyaka cheyu ","timestamp":1766152948634,"date":"2025-12-19 19:32:28.634"}
{"sender":"+919573724969","body":"Nina matladam kudarledhu sorry ani call chesaaa ","timestamp":1766152938988,"date":"2025-12-19 19:32:18.988"}
{"sender":"+919573724969","body":"Noo","timestamp":1766152913440,"date":"2025-12-19 19:31:53.440"}
{"sender":"+919573724969","body":"Anything urgent ?","timestamp":1766152905196,"date":"2025-12-19 19:31:45.196"}
{"sender":"+919573724969","body":"Okay Bhaya ","timestamp":1766152895894,"date":"2025-12-19 19:31:35.894"}
{"sender":"+919573724969","body":"Haa bhaya cheppy","timestamp":1766152895407,"date":"2025-12-19 19:31:35.407"}
{"sender":"+919573724969","body":"Bhaya ","timestamp":1766152886564,"date":"2025-12-19 19:31:26.564"}
{"sender":"+919573724969","body":"Will call bhaya in 20 mind","timestamp":1766152885857,"date":"2025-12-19 19:31:25.857"}
{"sender":"AA-AIRINF-S","body":"Hi, your Apple Music subscription is about to end. Rs. 119 will be added to your Airtel bill in 5 days as payment for Apple Music. To opt out, please visit Airtel Thanks App i.airtel.in\/thanks","timestamp":1766137834297,"date":"2025-12-19 15:20:34.297"}
{"sender":"CP-HDFCBK-S","body":"HDFC Bank Cardmember, Online Payment of Rs.3601 vide Ref# 352072714CkWFSW was credited to your card ending 3838 On 18\/DEC\/2025_value Date 18\/DEC\/2025","timestamp":1766135685552,"date":"2025-12-19 14:44:45.552"}
{"sender":"CP-HDFCBK-S","body":"HDFC Bank Cardmember, Online Payment of Rs.12749 vide Ref# 352072929UeXg09 was credited to your card ending 7725 On 18\/DEC\/2025_value Date 18\/DEC\/2025","timestamp":1766133786231,"date":"2025-12-19 14:13:06.231"}
{"sender":"CP-HDFCBK-S","body":"Available Bal in HDFC Bank A\/c XX2725 as on yesterday:18-DEC-25 is INR 74,240.63. Cheques are subject to clearing.For updated A\/C Bal dial 18002703333.","timestamp":1766108456101,"date":"2025-12-19 07:10:56.101"}
{"sender":"JD-ICICIT-S","body":"Dear Customer, your payment of INR 199.00 for NETFLIX to be debited from your ICICI Bank Credit Card 0006, as per Standing Instructions XI0YTidAvD, is due by 21\/12\/2025. To cancel this debit or your Standing Instructions, visit www.icicibank.com >Cards>Credit Cards>Standing Instructions and Recurring Charges>Manage Standing Instructions.","timestamp":1766098680119,"date":"2025-12-19 04:28:00.119"}
{"sender":"VK-CDSLTX-S","body":"CDSL: Debit in a\/c *67852716 for 2103.309-ICICI MFGF D-GROW, 3500-MOMF FCF D-GROW on 18DEC","timestamp":1766074287034,"date":"2025-12-18 21:41:27.034"}
{"sender":"AD-HDFCBK-S","body":"Txn Rs.30.00\nOn HDFC Bank Card 7725\nAt q303551895@ybl \nby UPI 571819148647\nOn 18-12\nNot You?\nCall 18002586161\/SMS BLOCK CC 7725 to 7308080808\n","timestamp":1766069863288,"date":"2025-12-18 20:27:43.288"}
{"sender":"+919573724969","body":"Okayy","timestamp":1766052127811,"date":"2025-12-18 15:32:07.811"}
{"sender":"+919573724969","body":"Intiki velli chestha","timestamp":1766052123351,"date":"2025-12-18 15:32:03.351"}
{"sender":"+919573724969","body":"Workshop lo unna bhaya","timestamp":1766052118109,"date":"2025-12-18 15:31:58.109"}
{"sender":"+919573724969","body":"In meeting bhaya oka 5 mins","timestamp":1766050322971,"date":"2025-12-18 15:02:02.971"}
{"sender":"CP-IDFCFB-S","body":"Effective 18th Jan 2026, some features and Terms & Conditions on your IDFC FIRST Bank Credit Card will be revised. For details, visit: https:\/\/idfcfr.in\/IDFCFB\/RvKtdE","timestamp":1766035322578,"date":"2025-12-18 10:52:02.578"}
{"sender":"AD-HDFCBK-S","body":"Sent Rs.2000.00\nFrom HDFC Bank A\/C *2725\nTo Zerodha Broking Limited\nOn 18\/12\/25\nRef 108783637865\nNot You?\nCall 18002586161\/SMS BLOCK UPI to 7308080808\n","timestamp":1766024495880,"date":"2025-12-18 07:51:35.880"}
{"sender":"VM-PHONPE-S","body":"Zerodha Broking Limited has requested money from you on PhonePe.Rs.2000 will be debited from your account on approving the request - https:\/\/phone.pe\/PHONPE\/tp9ca5l3","timestamp":1766024469466,"date":"2025-12-18 07:51:09.466"}
{"sender":"CP-HDFCBK-S","body":"Available Bal in HDFC Bank A\/c XX2725 as on yesterday:17-DEC-25 is INR 92,584.63. Cheques are subject to clearing.For updated A\/C Bal dial 18002703333.","timestamp":1766024140116,"date":"2025-12-18 07:45:40.116"}
{"sender":"AD-HDFCBK-S","body":"DEAR HDFCBANK CARDMEMBER, PAYMENT OF Rs. 12749.00 RECEIVED TOWARDS YOUR CREDIT CARD ENDING WITH 7725 ON 18-12-2025.YOUR AVAILABLE LIMIT IS RS. 448899.95","timestamp":1766023171304,"date":"2025-12-18 07:29:31.304"}
{"sender":"AD-HDFCBK-S","body":"Sent Rs.12744.00\nFrom HDFC Bank A\/C *2725\nTo CRED Club\nOn 18\/12\/25\nRef 571801034326\nNot You?\nCall 18002586161\/SMS BLOCK UPI to 7308080808\n","timestamp":1766023169895,"date":"2025-12-18 07:29:29.895"}
{"sender":"AD-HDFCBK-S","body":"DEAR HDFCBANK CARDMEMBER, PAYMENT OF Rs. 3601.00 RECEIVED TOWARDS YOUR CREDIT CARD ENDING WITH 3838 ON 18-12-2025.YOUR AVAILABLE LIMIT IS RS. 441531.60","timestamp":1766023037190,"date":"2025-12-18 07:27:17.190"}
{"sender":"VM-HDFCBK-S","body":"Sent Rs.3600.00\nFrom HDFC Bank A\/C *2725\nTo CRED Club\nOn 18\/12\/25\nRef 571819035771\nNot You?\nCall 18002586161\/SMS BLOCK UPI to 7308080808\n","timestamp":1766023035535,"date":"2025-12-18 07:27:15.535"}
{"sender":"VM-HDFCBK-S","body":"Your HDFC Bank Credit Card XX3838 Statement is generated View: https:\/\/hdfcbk.io\/HDFCBK\/v\/DOCIPM Pay: hdfcbk.io\/HDFCBK\/K\/DUvfEwWRFA1","timestamp":1766004923464,"date":"2025-12-18 02:25:23.464"}
{"sender":"AD-HDFCBK-S","body":"HDFC Bank Credit Card XX7725 Statement:\nTotal due: Rs.12,749.00\nMin.due: Rs.640.00\nPay by 05-01-2026\nView: https:\/\/hdfcbk.io\/HDFCBK\/a\/16tzA4w","timestamp":1765999524694,"date":"2025-12-18 00:55:24.694"}
{"sender":"VM-HDFCBK-S","body":"Credit Alert!\nRs.2.00 credited to HDFC Bank A\/c XX2725 on 17-12-25 from VPA googlepay@axisbank (UPI 485528413515)\n","timestamp":1765983686946,"date":"2025-12-17 20:31:26.946"}
{"sender":"VM-HDFCBK-S","body":"UPI Mandate:\nSent Rs.2.00\nfrom HDFC Bank A\/c 2725\nTo Google Play\n17\/12\/25\nRef 485479523515\nNot You? Call 18002586161\/SMS BLOCK UPI to 7308080808\n","timestamp":1765983658793,"date":"2025-12-17 20:30:58.793"}
{"sender":"AD-HDFCBK-S","body":"Your UPI-Mandate for Rs 3599.00 is successfully created towards GOOGLE INDIA DIGITAL SERVICES PVT LTD from A\/c No: **2725. UMN:45a98ea415d14ae99ce190e65bba12af@ybl. If not you, kindly report on 18002586161.","timestamp":1765983649545,"date":"2025-12-17 20:30:49.545"}
{"sender":"JM-PHONPE-S","body":"GOOGLE INDIA DIGITAL SERVICES PVT LTD has sent you an AutoPay request for up to Rs. 3599. Click to approve this request now: https:\/\/phone.pe\/PHONPE\/xolu7yf0","timestamp":1765983630756,"date":"2025-12-17 20:30:30.756"}
{"sender":"VM-HDFCBK-S","body":"Txn Rs.100.00\nOn HDFC Bank Card 7725\nAt paytmqr6mqyk9@ptys \nby UPI 571707979891\nOn 17-12\nNot You?\nCall 18002586161\/SMS BLOCK CC 7725 to 7308080808\n","timestamp":1765977055110,"date":"2025-12-17 18:40:55.110"}
{"sender":"JX-620040-P","body":"You're one step away! Claim FREE 18-month Google Gemini Pro plan worth Rs.35100. Get 2000 GB cloud storage to keep every favorite memory safe forever. Claim now https:\/\/www.jio.com\/dl\/sms-cn-ggo . Jio T&C apply","timestamp":1765965172441,"date":"2025-12-17 15:22:52.441"}
{"sender":"CP-HDFCBN-S","body":"Amt Due: Rs 3601 on HDFC Bank Credit Card 3838. Pay Instant with PayZapp. Steps: PayZapp-Bill-Credit Card Pay Now: https:\/\/hdfcbk.io\/HDFCBK\/s\/GZ1GkGyp","timestamp":1765961594119,"date":"2025-12-17 14:23:14.119"}
{"sender":"CP-HDFCBN-S","body":"Amt Due: Rs 12749 on HDFC Bank Credit Card 7725. Pay Instant with PayZapp. Steps: PayZapp-Bill-Credit Card Pay Now: https:\/\/hdfcbk.io\/HDFCBK\/s\/PjX2GB6L","timestamp":1765961477749,"date":"2025-12-17 14:21:17.749"}
{"sender":"CP-HDFCBN-S","body":"Dear Customer,\nRegarding your HDFC Bank Loan facility: Zero Processing Fee applicable.\nView details: https:\/\/hdfcbk.io\/HDFCBK\/s\/lv9b6kN9\nT&C","timestamp":1765946155910,"date":"2025-12-17 10:05:55.910"}
{"sender":"CP-HDFCBK-S","body":"Update! INR 51,839.00 deposited in HDFC Bank A\/c XX2725 on 17-DEC-25 for NEFT Cr-SURY0BK0000-GODALA SAIKUMAR REDDY-GODALA SAIKUMAR REDDY-SURYN25351683110.Avl bal INR 92,584.63. Cheque deposits in A\/C are subject to clearing","timestamp":1765933316101,"date":"2025-12-17 06:31:56.101"}
{"sender":"BV-EPFOHO-G","body":"Dear XXXXXXXX8475, your passbook balance against APHYD**************5194 is Rs. 28,450\/-. Contribution of Rs. 28,450\/- for due month Dec-25 has been received.","timestamp":1765908288201,"date":"2025-12-16 23:34:48.201"}
{"sender":"VK-BSELTD-S","body":"ZERODHA BROKING at EOD 28\/11\/2025 reported your Fund bal Rs -88.500 & Securities bal 0. This excludes your Bank, DP and PMS bal with the broker-BSE","timestamp":1765897137306,"date":"2025-12-16 20:28:57.306"}
{"sender":"VM-AXISBK-S","body":"Spent INR 209\nAxis Bank Card no. XX8887\n16-12-25 16:59:23 IST\nPYU*Swiggy\nAvl Limit: INR 299408\nNot you? SMS BLOCK 8887 to 919951860002","timestamp":1765884568420,"date":"2025-12-16 16:59:28.420"}
{"sender":"JA-JIONET-S","body":"Congratulations! \nYour Jio number is now active with 3 - month complimentary JioHotstar subscription.\nPlease note, this subscription can be availed only once per Jio Number.\nLog in to JioHotstar app with your Jio number and enjoy live cricket, movies, TV shows, and more! \nYou can also experience 50 days of free JioAirFiber as part of Jio Unlimited Offer! Call 60008-60008 or visit https:\/\/tiny.jio.com\/jiounlimitedoffer to register your interest. T&C apply.\nHappy watching!\nTeam Jio","timestamp":1765884422204,"date":"2025-12-16 16:57:02.204"}
{"sender":"VM-JIOHTT-S","body":"Your Jio Cricket offer - 4K Mobile\/TV with Jio is now ACTIVE on 9392897076.\nStart watching on JioHotstar https:\/\/gs.im\/JIOHTT\/e\/dfpXkhDujo1","timestamp":1765884418647,"date":"2025-12-16 16:56:58.647"}
{"sender":"JA-ISATHI-G","body":"మోసపూరిత కాల్\/ఎస్ఎంఎస్\/వాట్సాప్ గురించి ఫిర్యాదు చేయాలనుకుంటున్నారా? నివేదించడానికి సంచార్ సాథీని డౌన్లోడ్ చేయండి: Android: https:\/\/play.google.com\/store\/apps\/details?id=com.dot.app.sancharsaathi IOS: https:\/\/apps.apple.com\/in\/app\/sanchar-saathi\/id6739700695 డిపార్ట్మెంట్ ఆఫ్ టెలికాం, భారత ప్రభుత్వం","timestamp":1765873361884,"date":"2025-12-16 13:52:41.884"}
{"sender":"JM-HDFCBK-S","body":"Available Bal in HDFC Bank A\/c XX2725 as on yesterday:15-DEC-25 is INR 40,745.63. Cheques are subject to clearing.For updated A\/C Bal dial 18002703333.","timestamp":1765851223345,"date":"2025-12-16 07:43:43.345"}
{"sender":"AD-HDFCBK-S","body":"Credit Alert!\nRs.2.00 credited to HDFC Bank A\/c XX2725 on 15-12-25 from VPA googlepay@axisbank (UPI 938320873495)\n","timestamp":1765818368292,"date":"2025-12-15 22:36:08.292"}
{"sender":"VM-HDFCBK-S","body":"UPI Mandate:\nSent Rs.2.00\nfrom HDFC Bank A\/c 2725\nTo Google Play\n15\/12\/25\nRef 938252973495\nNot You? Call 18002586161\/SMS BLOCK UPI to 7308080808\n","timestamp":1765818354120,"date":"2025-12-15 22:35:54.120"}
{"sender":"AD-HDFCBK-S","body":"Your UPI-Mandate for Rs 1950.00 is successfully created towards GOOGLE INDIA DIGITAL SERVICES PVT LTD from A\/c No: **2725. UMN:ab63d77c501e40efb76d5fc21df85631@ybl. If not you, kindly report on 18002586161.","timestamp":1765818334539,"date":"2025-12-15 22:35:34.539"}
{"sender":"AD-PHONPE-S","body":"GOOGLE INDIA DIGITAL SERVICES PVT LTD has sent you an AutoPay request for up to Rs. 1950. Click to approve this request now: https:\/\/phone.pe\/PHONPE\/x9vhpuvu","timestamp":1765818317435,"date":"2025-12-15 22:35:17.435"}
{"sender":"VM-HDFCBK-S","body":"Txn Rs.50.00\nOn HDFC Bank Card 7725\nAt q416761384@ybl \nby UPI 571500697164\nOn 15-12\nNot You?\nCall 18002586161\/SMS BLOCK CC 7725 to 7308080808\n","timestamp":1765805502583,"date":"2025-12-15 19:01:42.583"}
{"sender":"JM-620040-P","body":"You're one step away! Claim FREE 18-month Google Gemini Pro plan worth Rs.35100. Turn your ideas into high-quality videos instantly with Veo 3.1. Claim now https:\/\/www.jio.com\/dl\/sms-cn-ggo . Jio T&C apply.","timestamp":1765792199580,"date":"2025-12-15 15:19:59.580"}
{"sender":"JM-HDFCBK-S","body":"Available Bal in HDFC Bank A\/c XX2725 as on yesterday:14-DEC-25 is INR 40,745.63. Cheques are subject to clearing.For updated A\/C Bal dial 18002703333.","timestamp":1765763531942,"date":"2025-12-15 07:22:11.942"}
{"sender":"VM-HDFCBK-S","body":"Sent Rs.340.00\nFrom HDFC Bank A\/C *2725\nTo MD ASIF AHMED\nOn 14\/12\/25\nRef 571411514130\nNot You?\nCall 18002586161\/SMS BLOCK UPI to 7308080808\n","timestamp":1765704415237,"date":"2025-12-14 14:56:55.237"}
{"sender":"VM-HDFCBK-S","body":"Sent Rs.205.00\nFrom HDFC Bank A\/C *2725\nTo KALALU KAMALAKAR GOUD\nOn 14\/12\/25\nRef 571419477771\nNot You?\nCall 18002586161\/SMS BLOCK UPI to 7308080808\n","timestamp":1765695448386,"date":"2025-12-14 12:27:28.386"}
{"sender":"VM-AXISBK-S","body":"Payment of INR 4405.46 has been received towards your Axis Bank Credit Card XX8887 on 14-12-25 - Axis Bank","timestamp":1765685526265,"date":"2025-12-14 09:42:06.265"}
{"sender":"VM-HDFCBK-S","body":"Sent Rs.4373.46\nFrom HDFC Bank A\/C *2725\nTo CRED Club\nOn 14\/12\/25\nRef 571414448876\nNot You?\nCall 18002586161\/SMS BLOCK UPI to 7308080808\n","timestamp":1765685472629,"date":"2025-12-14 09:41:12.629"}
{"sender":"AX-AXISBK-S","body":"Statement for your Axis Bank Credit Card no. XX8887 has been generated.\nDue on: 01-01-26\nTotal amt: INR  Dr. 4405.46\nMin amt due: INR  Dr. 100.00\nTo pay, visit axisbank.com\/ccpaynow\nTo view the fees & charges, visit https:\/\/ccm.axbk.in\/AXISBK\/ApCh7aMn\nTo view \/ download the statement, visit https:\/\/ccm.axis.bank.in\/AXISBK\/wWJmuYdY","timestamp":1765681918316,"date":"2025-12-14 08:41:58.316"}
{"sender":"JM-HDFCBK-S","body":"Available Bal in HDFC Bank A\/c XX2725 as on yesterday:13-DEC-25 is INR 45,664.09. Cheques are subject to clearing.For updated A\/C Bal dial 18002703333.","timestamp":1765679117392,"date":"2025-12-14 07:55:17.392"}
{"sender":"AD-ICICIT-S","body":"Dear Customer, we have successfully processed the payment of INR 1039.00 for UDEMY INDIA LLP, as per the Standing Instruction XpZj3GyZnU, on 14\/12\/2025 for your ICICI Bank Credit Card 0006. To manage your Standing Instructions, visit https:\/\/icici.co\/ICICIT\/ar\/16sDg22 >Cards >Credit Cards>Standing Instructions and Recurring Charges>Manage Standing Instructions.","timestamp":1765657680574,"date":"2025-12-14 01:58:00.574"}
{"sender":"VM-ICICIT-S","body":"INR 1,039.00 spent using ICICI Bank Card XX0006 on 14-Dec-25 on UDEMY SUBSCRIPT. Avl Limit: INR 7,14,769.00. If not you, call 1800 2662\/SMS BLOCK 0006 to 9215676766.","timestamp":1765657561863,"date":"2025-12-14 01:56:01.863"}
{"sender":"VM-HDFCBK-S","body":"Credit Alert!\nRs.25000.00 credited to HDFC Bank A\/c XX2725 on 13-12-25 from VPA nagireddyshirisha9@axl (UPI 625072602864)\n","timestamp":1765635638507,"date":"2025-12-13 19:50:38.507"}
{"sender":"JM-620040-P","body":"You're one step away! Claim FREE 18-month Google Gemini Pro plan worth Rs.35100. Talk naturally to Gemini Live in your own language. Claim now https:\/\/www.jio.com\/dl\/sms-cn-ggo . Jio T&C apply.","timestamp":1765630874695,"date":"2025-12-13 18:31:14.695"}
{"sender":"JA-ISATHI-G","body":"Want to report a fraud call\/ SMS\/ WhatsApp? Download Sanchar Saathi to report: Android: https:\/\/play.google.com\/store\/apps\/details?id=com.dot.app.sancharsaathi iOS: https:\/\/apps.apple.com\/in\/app\/sanchar-saathi\/id6739700695 Department of Telecom","timestamp":1765618366535,"date":"2025-12-13 15:02:46.535"}
{"sender":"JD-PHRMSY-P","body":"YES Sale is LIVE. Upto 25% OFF on medicines + a chance to win iPhone 17. Shop Now: https:\/\/gs.im\/PHRMSY\/e\/uDbIpmBtKYB *TC PharmEasy","timestamp":1765611409691,"date":"2025-12-13 13:06:49.691"}
{"sender":"CP-AXISBK-S","body":"Spent INR 308\nAxis Bank Card no. XX8887\n13-12-25 12:13:27 IST\nRazorpay*Sw\nAvl Limit: INR 295211.54\nNot you? SMS BLOCK 8887 to 919951860002","timestamp":1765608211676,"date":"2025-12-13 12:13:31.676"}
{"sender":"JM-HDFCBK-S","body":"Available Bal in HDFC Bank A\/c XX2725 as on yesterday:12-DEC-25 is INR 20,664.09. Cheques are subject to clearing.For updated A\/C Bal dial 18002703333.","timestamp":1765597962924,"date":"2025-12-13 09:22:42.924"}
{"sender":"AD-ICICIT-S","body":"Dear Customer, your payment of INR 1039.00 for UDEMY INDIA LLP to be debited from your ICICI Bank Credit Card 0006, as per Standing Instructions XpZj3GyZnU, is due by 14\/12\/2025. To cancel this debit or your Standing Instructions, visit https:\/\/icici.co\/ICICIT\/ar\/16sm3LL >Cards>Credit Cards>Standing Instructions and Recurring Charges>Manage Standing Instructions.","timestamp":1765563818457,"date":"2025-12-12 23:53:38.457"}
{"sender":"AD-AIRDOT-S","body":"Alert: On receiving any unwanted SMS , please complain by calling 1909 or send SMS to 1909 in format 'SMS Content, Sender No, dd\/mm\/yy' or visit bit.ly\/2qBK0vp to report through Airtel Thanks App.","timestamp":1765559490411,"date":"2025-12-12 22:41:30.411"}
{"sender":"AD-HDFCBK-S","body":"Spent Rs.2478 On HDFC Bank Card 3838 At DINEOUT1263552 On 2025-12-12:22:04:11.Not You? To Block+Reissue Call 18002586161\/SMS BLOCK CC 3838 to 7308080808","timestamp":1765557258102,"date":"2025-12-12 22:04:18.102"}
{"sender":"VM-HDFCBK-S","body":"Login Alert! Thank you for using HDFC Bank online banking. Not you? Call 18002586161","timestamp":1765557164982,"date":"2025-12-12 22:02:44.982"}
{"sender":"AX-AXISBK-S","body":"Spent INR 75\nAxis Bank Card no. XX8887\n12-12-25 22:01:15 IST\nCAS*Swiggy\nAvl Limit: INR 295519.54\nNot you? SMS BLOCK 8887 to 919951860002","timestamp":1765557079300,"date":"2025-12-12 22:01:19.300"}
{"sender":"AD-PPOOJA-S","body":"Loyalty wallet for Your Bezawada Junction is loaded with 100 points. It will expire on 2026-01-26. Current wallet balance: 100.00 - Petpooja","timestamp":1765556983239,"date":"2025-12-12 21:59:43.239"}
{"sender":"AX-PPOOJA-S","body":"Loyalty Points 100 reverted at Bezawada Junction for order Edit. Remaining balance is 0 - Petpooja","timestamp":1765556980873,"date":"2025-12-12 21:59:40.873"}
{"sender":"AX-PPOOJA-S","body":"Loyalty Points 100 reverted at Bezawada Junction for order Edit. Remaining balance is 0 - Petpooja","timestamp":1765556204358,"date":"2025-12-12 21:46:44.358"}
{"sender":"AX-PPOOJA-S","body":"Loyalty wallet for Your Bezawada Junction is loaded with 100 points. It will expire on 2026-01-26. Current wallet balance: 100.00 - Petpooja","timestamp":1765556203653,"date":"2025-12-12 21:46:43.653"}
{"sender":"AD-ICICIT-S","body":"INR 79.00 spent using ICICI Bank Card XX0006 on 12-Dec-25 on AMAZON INDIA CY. Avl Limit: INR 7,15,808.00. If not you, call 1800 2662\/SMS BLOCK 0006 to 9215676766.","timestamp":1765552446164,"date":"2025-12-12 20:44:06.164"}
{"sender":"AD-ICICIT-S","body":"Dear Customer, we have successfully processed the payment of INR 79.00 for Amazon, as per the Standing Instruction Xz6JCD7Lv9, on 12\/12\/2025 for your ICICI Bank Credit Card 0006. To manage your Standing Instructions, visit https:\/\/icici.co\/ICICIT\/ar\/16slA6K >Cards >Credit Cards>Standing Instructions and Recurring Charges>Manage Standing Instructions.","timestamp":1765552431167,"date":"2025-12-12 20:43:51.167"}
{"sender":"AX-TVSMTR-S","body":"Thanks for doing service in our showroom. Please click the link to get your invoice copy m2sm.com\/ . Team TVSM Dealership","timestamp":1765544263808,"date":"2025-12-12 18:27:43.808"}
{"sender":"AD-HDFCBK-S","body":"Txn Rs.2690.00\nOn HDFC Bank Card 7725\nAt paytm.s10dwjz@pta \nby UPI 108747274670\nOn 12-12\nNot You?\nCall 18002586161\/SMS BLOCK CC 7725 to 7308080808\n","timestamp":1765544257420,"date":"2025-12-12 18:27:37.420"}
{"sender":"AX-TVSMTR-S","body":"Dear GODALASAIKUMAR REDDY, Your TVS APACHE RTR 200 4V-R.MODE 2CH BLK is ready for delivery after Service. Approx Bill amt is Rs 2690.00.TVS Dealership ARJUN TWO WHEELERS PVT LTD. For any clarifications contact our Service Advisor ANNAPURNA SANDIRI PH No:  918977746182","timestamp":1765542156634,"date":"2025-12-12 17:52:36.634"}
{"sender":"AX-TVSMOT-S","body":"Dear Mr\/Ms GODALASAIKUMAR REDDY, we have started working on your vehicle. Click on the link m2sm.com\/B6y6pfIZlRT to see the photos shared by TVSM Job card No-20078 T&C.TVSM Dealership","timestamp":1765537558823,"date":"2025-12-12 16:35:58.823"}
{"sender":"VM-HDFCBK-S","body":"Sent Rs.170.00\nFrom HDFC Bank A\/C *2725\nTo A MANOHARACHARI\nOn 12\/12\/25\nRef 571221173813\nNot You?\nCall 18002586161\/SMS BLOCK UPI to 7308080808\n","timestamp":1765527175751,"date":"2025-12-12 13:42:55.751"}
{"sender":"AD-HDFCBK-S","body":"Sent Rs.60.00\nFrom HDFC Bank A\/C *2725\nTo Neerudi  Srinivas\nOn 12\/12\/25\nRef 571205163986\nNot You?\nCall 18002586161\/SMS BLOCK UPI to 7308080808\n","timestamp":1765525436909,"date":"2025-12-12 13:13:56.909"}
{"sender":"AD-HDFCBK-S","body":"Txn Rs.448.00\nOn HDFC Bank Card 7725\nAt paytm.d13387673732@pty \nby UPI 571205159651\nOn 12-12\nNot You?\nCall 18002586161\/SMS BLOCK CC 7725 to 7308080808\n","timestamp":1765523698928,"date":"2025-12-12 12:44:58.928"}
{"sender":"AD-TVSMTR-S","body":"Welcome to ARJUN TWO WHEELERS PVT LTD. Token number for your visit dated 12-Dec-2025 is 41. Please share this Token No with our Service Adviser for Job Card Creation. TVSM Dealership","timestamp":1765519387453,"date":"2025-12-12 11:33:07.453"}
{"sender":"AD-HDFCBK-S","body":"Txn Rs.60.00\nOn HDFC Bank Card 7725\nAt q933297054@ybl \nby UPI 571108101225\nOn 11-12\nNot You?\nCall 18002586161\/SMS BLOCK CC 7725 to 7308080808\n","timestamp":1765466428858,"date":"2025-12-11 20:50:28.858"}
{"sender":"JM-620040-P","body":"You're one step away! Claim FREE 18-month Google Gemini Pro plan worth Rs.35100. Generate AI images and edit your photos like a pro with Nano Banana. Claim now https:\/\/www.jio.com\/dl\/sms-cn-ggo . Jio T&C apply.","timestamp":1765455319244,"date":"2025-12-11 17:45:19.244"}
{"sender":"JM-SBICRD-S","body":"Dear Cardholder, there is a credit balance of Rs. 589.42 available on your SBI Card account as on 11-Dec-2025. You can utilize this amount against any transaction(s) made with your credit card. Please ignore if already utilized.","timestamp":1765453279554,"date":"2025-12-11 17:11:19.554"}
{"sender":"VD-PVRVIP-P","body":"Theatres tremble as Nandamuri Balakrishna brings faith, fire & fearless energy in Akhanda 2 (Thandavam). Book @ PVR- https:\/\/c.pvrdm.in\/PVRVIP\/QFsYsZu6b","timestamp":1765447564132,"date":"2025-12-11 15:36:04.132"}
{"sender":"JM-HDFCBK-S","body":"Available Bal in HDFC Bank A\/c XX2725 as on yesterday:10-DEC-25 is INR 20,894.09. Cheques are subject to clearing.For updated A\/C Bal dial 18002703333.","timestamp":1765418549854,"date":"2025-12-11 07:32:29.854"}
{"sender":"JM-NOBRKR-S","body":"Hey,\nAs requested by you, here are the list of properties in Puppalguda matching your preference : http:\/\/nobr.kr\/NOBRKR\/sy\/M8qt54.\nNoBroker","timestamp":1765351109858,"date":"2025-12-10 12:48:29.858"}
{"sender":"AD-ICICIT-S","body":"INR 1,804.00 spent using ICICI Bank Card XX0006 on 10-Dec-25 on AMAZON PAY IN E. Avl Limit: INR 7,15,887.00. If not you, call 1800 2662\/SMS BLOCK 0006 to 9215676766.","timestamp":1765343857656,"date":"2025-12-10 10:47:37.656"}
{"sender":"AD-HDFCBK-S","body":"Sent Rs.1000.00\nFrom HDFC Bank A\/C *2725\nTo PRATIKSHA\nOn 10\/12\/25\nRef 021563872065\nNot You?\nCall 18002586161\/SMS BLOCK UPI to 7308080808\n","timestamp":1765343118425,"date":"2025-12-10 10:35:18.425"}
{"sender":"JM-HDFCBK-S","body":"Available Bal in HDFC Bank A\/c XX2725 as on yesterday:09-DEC-25 is INR 21,894.09. Cheques are subject to clearing.For updated A\/C Bal dial 18002703333.","timestamp":1765332427852,"date":"2025-12-10 07:37:07.852"}
{"sender":"AD-ICICIT-S","body":"Dear Customer, your payment of INR 79.00 for Amazon to be debited from your ICICI Bank Credit Card 0006, as per Standing Instructions Xz6JCD7Lv9, is due by 12\/12\/2025. To cancel this debit or your Standing Instructions, visit https:\/\/icici.co\/ICICIT\/ar\/16r8Sw5 >Cards>Credit Cards>Standing Instructions and Recurring Charges>Manage Standing Instructions.","timestamp":1765291551691,"date":"2025-12-09 20:15:51.691"}
{"sender":"AX-PTNNPS-S","body":"PRAN XX9811: Units for (NOV-2025) contribution of Rs.9,758.13 credited with NAV of 08\/12\/25 -Protean","timestamp":1765280722361,"date":"2025-12-09 17:15:22.361"}
{"sender":"JA-ISATHI-G","body":"మొబైల్ కనెక్షన్ కోసం ఎవరైనా మీ పేరును దుర్వినియోగం చేస్తున్నారా? తనిఖీ చేయడానికి సంచార్ సాథీని డౌన్లోడ్ చేయండి: Android: https:\/\/play.google.com\/store\/apps\/details?id=com.dot.app.sancharsaathi IOS: https:\/\/apps.apple.com\/in\/app\/sanchar-saathi\/id6739700695 డిపార్ట్మెంట్ ఆఫ్ టెలికాం, భారత ప్రభుత్వం","timestamp":1765275252536,"date":"2025-12-09 15:44:12.536"}
{"sender":"JD-NOBRKR-S","body":"Hey,\nAs requested by you, here are the list of properties in Puppalguda matching your preference : http:\/\/nobr.kr\/NOBRKR\/sy\/xVJb54.\nNoBroker","timestamp":1765264716396,"date":"2025-12-09 12:48:36.396"}
{"sender":"AD-AXISBK-S","body":"Congratulations! Cashback of INR 896 has been credited to your Airtel Axis Bank Credit Card XX8887 towards your spends during NOV'25.","timestamp":1765257107572,"date":"2025-12-09 10:41:47.572"}
{"sender":"57575794","body":"A driver has a message about your order. Reply STOP to stop receiving texts from Amazon for deliveries and pickups.\nanna lift lo pettnanu tiskondi 🙏","timestamp":1765253504210,"date":"2025-12-09 09:41:44.210"}
{"sender":"57575794","body":"Delivery Completed","timestamp":1765253468022,"date":"2025-12-09 09:41:08.022"}
{"sender":"AD-HDFCBK-S","body":"Sent Rs.5000.00\nFrom HDFC Bank A\/C *2725\nTo GODALA  SIRISHA\nOn 09\/12\/25\nRef 030366663844\nNot You?\nCall 18002586161\/SMS BLOCK UPI to 7308080808\n","timestamp":1765248097682,"date":"2025-12-09 08:11:37.682"}
{"sender":"JM-HDFCBK-S","body":"Available Bal in HDFC Bank A\/c XX2725 as on yesterday:08-DEC-25 is INR 26,894.09. Cheques are subject to clearing.For updated A\/C Bal dial 18002703333.","timestamp":1765247420620,"date":"2025-12-09 08:00:20.620"}
{"sender":"JA-TRAIND-G","body":"Report spam for action against spammers. However, blocking spammer on calling app of phone does not lead to action against spammer. Report spam on TRAI DND App or service provider App or 1909. Reporting on TRAI DND App is easy and quick, install today.","timestamp":1765192121050,"date":"2025-12-08 16:38:41.050"}
{"sender":"JA-ISATHI-G","body":"Is someone misusing your name for a Mobile Connection? Download Sanchar Saathi to check: Android: https:\/\/play.google.com\/store\/apps\/details?id=com.dot.app.sancharsaathi iOS: https:\/\/apps.apple.com\/in\/app\/sanchar-saathi\/id6739700695 Department of Telecom","timestamp":1765178664785,"date":"2025-12-08 12:54:24.785"}
{"sender":"VM-HDFCBK-S","body":"Sent Rs.70.00\nFrom HDFC Bank A\/C *2725\nTo A MANOHARACHARI\nOn 08\/12\/25\nRef 570816534573\nNot You?\nCall 18002586161\/SMS BLOCK UPI to 7308080808\n","timestamp":1765175964797,"date":"2025-12-08 12:09:24.797"}
{"sender":"AD-ICICIT-S","body":"INR 604.00 spent using ICICI Bank Card XX0006 on 08-Dec-25 on AMAZON PAY IN E. Avl Limit: INR 7,17,691.00. If not you, call 1800 2662\/SMS BLOCK 0006 to 9215676766.","timestamp":1765165042237,"date":"2025-12-08 09:07:22.237"}
{"sender":"VM-ICICIT-S","body":"INR 131.00 spent using ICICI Bank Card XX0006 on 08-Dec-25 on AMAZON PAY IN E. Avl Limit: INR 7,18,295.00. If not you, call 1800 2662\/SMS BLOCK 0006 to 9215676766.","timestamp":1765164932692,"date":"2025-12-08 09:05:32.692"}
{"sender":"JM-HDFCBK-S","body":"Available Bal in HDFC Bank A\/c XX2725 as on yesterday:07-DEC-25 is INR 26,964.09. Cheques are subject to clearing.For updated A\/C Bal dial 18002703333.","timestamp":1765158574594,"date":"2025-12-08 07:19:34.594"}
{"sender":"CP-BMSHOW-S","body":"Confirmed! Booking ID TCAGGLY\nClick for ticket\/s, offers and details:https:\/\/in.bookmyshow.com\/BMSTNY\/MJ31fD6jmA\n- BookMyShow","timestamp":1765110206545,"date":"2025-12-07 17:53:26.545"}
{"sender":"AD-HDFCBK-S","body":"Spent Rs.270.8 On HDFC Bank Card 3838 At BOOKMYSHOW10580 On 2025-12-07:17:53:18.Not You? To Block+Reissue Call 18002586161\/SMS BLOCK CC 3838 to 7308080808","timestamp":1765110204433,"date":"2025-12-07 17:53:24.433"}
{"sender":"VM-HDFCBK-S","body":"Txn Rs.20.00\nOn HDFC Bank Card 7725\nAt q416761384@ybl \nby UPI 108713261904\nOn 07-12\nNot You?\nCall 18002586161\/SMS BLOCK CC 7725 to 7308080808\n","timestamp":1765109605054,"date":"2025-12-07 17:43:25.054"}
{"sender":"JM-620040-P","body":"You're one step away! Claim FREE 18-month Google Gemini Pro plan worth Rs.35100. Turn your ideas into high-quality videos instantly with Veo 3.1. Claim now https:\/\/www.jio.com\/dl\/sms-cn-ggo . Jio T&C apply.","timestamp":1765106141821,"date":"2025-12-07 16:45:41.821"}
{"sender":"VM-HDFCBK-S","body":"Sent Rs.350.00\nFrom HDFC Bank A\/C *2725\nTo GODALA VIKAS REDDY\nOn 07\/12\/25\nRef 366697410019\nNot You?\nCall 18002586161\/SMS BLOCK UPI to 7308080808\n","timestamp":1765085056645,"date":"2025-12-07 10:54:16.645"}
{"sender":"AD-ICICIT-S","body":"INR 482.00 spent using ICICI Bank Card XX0006 on 07-Dec-25 on AMAZON PAY IN E. Avl Limit: INR 7,18,426.00. If not you, call 1800 2662\/SMS BLOCK 0006 to 9215676766.","timestamp":1765077738407,"date":"2025-12-07 08:52:18.407"}
{"sender":"JM-HDFCBK-S","body":"Available Bal in HDFC Bank A\/c XX2725 as on yesterday:06-DEC-25 is INR 27,314.09. Cheques are subject to clearing.For updated A\/C Bal dial 18002703333.","timestamp":1765071548386,"date":"2025-12-07 07:09:08.386"}
{"sender":"VM-HDFCBK-S","body":"Txn Rs.1787.00\nOn HDFC Bank Card 7725\nAt q493415905@ybl \nby UPI 570600272368\nOn 06-12\nNot You?\nCall 18002586161\/SMS BLOCK CC 7725 to 7308080808\n","timestamp":1765030812285,"date":"2025-12-06 19:50:12.285"}
{"sender":"VM-HDFCBK-S","body":"Txn Rs.50.00\nOn HDFC Bank Card 7725\nAt gpay-12195091492@okbizaxis \nby UPI 570602235151\nOn 06-12\nNot You?\nCall 18002586161\/SMS BLOCK CC 7725 to 7308080808\n","timestamp":1765021875170,"date":"2025-12-06 17:21:15.170"}
{"sender":"VM-HDFCBK-S","body":"Txn Rs.20.00\nOn HDFC Bank Card 7725\nAt gpay-12195084050@okbizaxis \nby UPI 570610240677\nOn 06-12\nNot You?\nCall 18002586161\/SMS BLOCK CC 7725 to 7308080808\n","timestamp":1765021802220,"date":"2025-12-06 17:20:02.220"}
